Item Title,Publication Title,Book Series Title,Journal Volume,Journal Issue,Item DOI,Authors,Publication Year,URL,Content Type
"N-Methyl-d-aspartate (NMDA) receptor antibody in relation to autism spectrum disorder (ASD): presence and association with symptom profile","Middle East Current Psychiatry","","28","1","10.1186/s43045-021-00141-5","Heba Hamed ElshahawiGhada Refaat Amin TahaHanan Mohamed Ezzeldin AzzamReem H. El GhamryAhmed Adel Mohammad AbdelgawadMohammad Abdullah Ahmad Abdullah Elshiekh","2021","http://link.springer.com/article/10.1186/s43045-021-00141-5","Article"
"Signing with the Face: Emotional Expression in Narrative Production in Deaf Children with Autism Spectrum Disorder","Journal of Autism and Developmental Disorders","","49","1","10.1007/s10803-018-3756-x","Tanya DenmarkJoanna AtkinsonRuth CampbellJohn Swettenham","2019","http://link.springer.com/article/10.1007/s10803-018-3756-x","Article"
"A survey of technologies for automatic Dysarthric speech recognition","EURASIP Journal on Audio, Speech, and Music Processing","","2023","1","10.1186/s13636-023-00318-2","Zhaopeng QianKejing XiaoChongchong Yu","2023","http://link.springer.com/article/10.1186/s13636-023-00318-2","Article"
"The German hearing in noise test with a female talker: development and comparison with German male speech test","European Archives of Oto-Rhino-Laryngology","","280","7","10.1007/s00405-023-07820-5","Anna-Lena MönnichSebastian StriethAndrea BohnertBenjamin Philipp ErnstTobias Rader","2023","http://link.springer.com/article/10.1007/s00405-023-07820-5","Article"
"Concepts, Frames and Cascades in Semantics, Cognition and Ontology","Language, Cognition, and Mind","","","","10.1007/978-3-030-50200-3","Prof. Sebastian LöbnerThomas GamerschlagTobias KalenscherProf. Dr. Markus SchrenkProf. Dr. Henk Zeevat","2021","http://link.springer.com/book/10.1007/978-3-030-50200-3","Book"
"Speech perception without hearing","Perception & Psychophysics","","62","2","10.3758/BF03205546","Lynne E. BernsteinPaula E. TuckerMarilyn E. Demorest","2000","http://link.springer.com/article/10.3758/BF03205546","Article"
"Dysphagia Diagnosis and Treatment: A Multidisciplinary Challenge","Dysphagia","","29","1","10.1007/s00455-013-9498-1","","2014","http://link.springer.com/article/10.1007/s00455-013-9498-1","Article"
"Effects of robots’ intonation and bodily appearance on robot-mediated communicative treatment outcomes for children with autism spectrum disorder","Personal and Ubiquitous Computing","","22","2","10.1007/s00779-017-1060-y","Caroline L. van StratenIris SmeekensEmilia BarakovaJeffrey GlennonJan BuitelaarAoju Chen","2018","http://link.springer.com/article/10.1007/s00779-017-1060-y","Article"
"SPRAAK: Speech Processing, Recognition and Automatic Annotation Kit","Essential Speech and Language Technology for Dutch","","","","10.1007/978-3-642-30910-6_6","Patrick WambacqKris DemuynckDirk Van Compernolle","2013","http://link.springer.com/chapter/10.1007/978-3-642-30910-6_6","Chapter"
"The effectiveness of parent training for children with autism spectrum disorder: a systematic review and meta-analyses","BMC Psychiatry","","20","1","10.1186/s12888-020-02973-7","Shoumitro (Shoumi) DebAmeeta RetzerMeera RoyRupali AcharyaBharati LimbuAshok Roy","2020","http://link.springer.com/article/10.1186/s12888-020-02973-7","Article"
"Music training enhances the automatic neural processing of foreign speech sounds","Scientific Reports","","7","1","10.1038/s41598-017-12575-1","Bastien IntartagliaTravis White-SchwochNina KrausDaniele Schön","2017","http://link.springer.com/article/10.1038/s41598-017-12575-1","Article"
"Poster sessions","Journal of Neurology","","251","3","10.1007/s00415-004-3002-7","","2004","http://link.springer.com/article/10.1007/s00415-004-3002-7","Article"
"ECR 2018 - BOOK OF ABSTRACTS","Insights into Imaging","","9","1","10.1007/s13244-018-0603-8","","2018","http://link.springer.com/article/10.1007/s13244-018-0603-8","Article"
"Abstracts","Journal of Inherited Metabolic Disease","","27","1","10.1007/BF03356117","","2004","http://link.springer.com/article/10.1007/BF03356117","Article"
"Quantitative Speech Assessment in Ataxia—Consensus Recommendations by the Ataxia Global Initiative Working Group on Digital-Motor Markers","The Cerebellum","","","","10.1007/s12311-023-01623-4","Adam P. VogelAnna SobanskaAnoopum GuptaGessica VascoMarcus Grobe-EinslerSusanna SummaStephanie Borel","2023","http://link.springer.com/article/10.1007/s12311-023-01623-4","Article"
"Evolutionary epistemology and the origin and evolution of language: Taking symbiogenesis seriously","Evolutionary Epistemology, Language and Culture","","","","10.1007/1-4020-3395-8_10","Nathalie Gontier","2006","http://link.springer.com/chapter/10.1007/1-4020-3395-8_10","Chapter"
"Cross-Modal Coordination of Face-Directed Gaze and Emotional Speech Production in School-Aged Children and Adolescents with ASD","Scientific Reports","","9","1","10.1038/s41598-019-54587-z","Tanner SorensenEmily ZaneTiantian FengShrikanth NarayananRuth Grossman","2019","http://link.springer.com/article/10.1038/s41598-019-54587-z","Article"
"Characterising the Long-Term Language Impairments of Children Following Cerebellar Tumour Surgery by Extracting Psycholinguistic Properties from Spontaneous Language","The Cerebellum","","","","10.1007/s12311-023-01563-z","Cheyenne SvaldiPhilippe PaquierStefanie KeulenHenrieke van ElpCoriene Catsman-BerrevoetsAnnet KingmaRoel JonkersSaskia KohnenVânia de Aguiar","2023","http://link.springer.com/article/10.1007/s12311-023-01563-z","Article"
"Speech Pathology Findings in Patients with Oral Breathing According to the Etiology","Pediatric Research","","70","5","10.1038/pr.2011.755","P JunqueiraI Q Marchesan","2011","http://link.springer.com/article/10.1038/pr.2011.755","Article"
"Contemporary Perspectives on Ageism","International Perspectives on Aging","","","","10.1007/978-3-319-73820-8","Prof. Liat AyalonProf. Dr. Clemens Tesch-Römer","2018","http://link.springer.com/book/10.1007/978-3-319-73820-8","Book"
"Auditory hallucinations activate language and verbal short-term memory, but not auditory, brain regions","Scientific Reports","","11","1","10.1038/s41598-021-98269-1","Paola Fuentes-ClaramonteJoan Soler-VidalPilar Salgado-PinedaMaría Ángeles García-LeónNuria RamiroAniol Santo-AnglesMaría Llanos TorresJosep TristanyAmalia Guerrero-PedrazaJosep MunueraSalvador SarróRaymond SalvadorWolfram HinzenPeter J. McKennaEdith Pomarol-Clotet","2021","http://link.springer.com/article/10.1038/s41598-021-98269-1","Article"
"Impaired socio-emotional processing in a developmental music disorder","Scientific Reports","","6","1","10.1038/srep34911","César F. LimaOlivia BrancatisanoAmy FancourtDaniel MüllensiefenSophie K. ScottJason D. WarrenLauren Stewart","2016","http://link.springer.com/article/10.1038/srep34911","Article"
"Presence of autism, hyperserotonemia, and severe expressive language impairment in Williams-Beuren syndrome","Molecular Autism","","4","1","10.1186/2040-2392-4-29","Sylvie TordjmanGeorge M AndersonDavid CohenSolenn KermarrecMichèle CarlierYvan TouitouPascale Saugier-VeberCéline LagneauxClaire ChevreuilAlain Verloes","2013","http://link.springer.com/article/10.1186/2040-2392-4-29","Article"
"Design of the PERSPECTIVE study: PERsonalized SPEeCh Therapy for actIVE conversation in Parkinson’s disease (randomized controlled trial)","Trials","","23","1","10.1186/s13063-022-06160-9","J. J. L. MaasN. M. De VriesB. R. BloemJ. G. Kalf","2022","http://link.springer.com/article/10.1186/s13063-022-06160-9","Article"
"The Palgrave Handbook of Digital Russia Studies","","","","","10.1007/978-3-030-42855-6","Daria GritsenkoMariëlle WijermarsMikhail Kopotev","2021","http://link.springer.com/book/10.1007/978-3-030-42855-6","Book"
"Association of Screentime and Speech Delay among Pre-School Age Children – An Exploratory Study","Indian Journal of Pediatrics","","90","12","10.1007/s12098-023-04770-y","Dhanasekhar KesaveluPriyadharshini V","2023","http://link.springer.com/article/10.1007/s12098-023-04770-y","Article"
"Abstracts","Annals of Behavioral Medicine","","43","1","10.1007/s12160-012-9354-9","","2012","http://link.springer.com/article/10.1007/s12160-012-9354-9","Article"
"Eye-voice span during rapid automatized naming: evidence of reduced automaticity in individuals with autism spectrum disorder and their siblings","Journal of Neurodevelopmental Disorders","","6","1","10.1186/1866-1955-6-33","Abigail L Hogan-BrownRenske S HoedemakerPeter C GordonMolly Losh","2014","http://link.springer.com/article/10.1186/1866-1955-6-33","Article"
"Speech apraxia and oral apraxia: association or dissociation? A multivariate lesion–symptom mapping study in acute stroke patients","Experimental Brain Research","","240","1","10.1007/s00221-021-06224-3","Martina ConternoDorothee KümmererAndrea DressingVolkmar GlaucheHorst UrbachCornelius WeillerMichel Rijntjes","2022","http://link.springer.com/article/10.1007/s00221-021-06224-3","Article"
"Freiburg Questionnaire of linguistic pragmatics (FQLP): psychometric properties based on a psychiatric sample","BMC Psychiatry","","14","1","10.1186/s12888-014-0374-9","Andreas RiedelHeejung SuhVerena HaserIsmene HermannDieter EbertDieter RiemannEmanuel BublLudger Tebartz van ElstLars P Hölzel","2014","http://link.springer.com/article/10.1186/s12888-014-0374-9","Article"
"PROMPT to improve speech motor abilities in children with cerebral palsy: a wait-list control group trial protocol","BMC Neurology","","22","1","10.1186/s12883-022-02771-6","S. FioriC. RagoniI. PoddaA. ChilosiC. AmadorP. CiprianiA. GuzzettaG. Sgandurra","2022","http://link.springer.com/article/10.1186/s12883-022-02771-6","Article"
"Diagnostic Evaluations of Autism Spectrum Disorder during the COVID-19 Pandemic","Journal of Autism and Developmental Disorders","","52","2","10.1007/s10803-021-04960-7","Jina JangStormi Pulver WhiteAmy N. EslerSo Hyun KimCheryl KlaimanJonathan T. MegerianAmy MorseCy NadlerStephen M. Kanne","2022","http://link.springer.com/article/10.1007/s10803-021-04960-7","Article"
"Aberrant neurophysiological signaling associated with speech impairments in Parkinson’s disease","npj Parkinson's Disease","","9","1","10.1038/s41531-023-00495-z","Alex I. WiesmanPeter W. DonhauserClotilde DegrootSabrina DiabShanna KousaieEdward A. FonDenise KleinSylvain Baillet","2023","http://link.springer.com/article/10.1038/s41531-023-00495-z","Article"
"Bilingual computerized speech-recognition screening for clinical depression: Evaluating a cellular telephone prototype","Behavior Research Methods, Instruments, & Computers","","27","4","10.3758/BF03200446","Gerardo M. GonzálezCraig R. CostelloMario ValenzuelaBeverly ChaidezArcela Nuñez-alvarez","1995","http://link.springer.com/article/10.3758/BF03200446","Article"
"Pivotal Response Treatment for Children with Autism Spectrum Disorders: A Systematic Review","Review Journal of Autism and Developmental Disorders","","1","1","10.1007/s40489-013-0008-z","Rianne VerschuurRobert DiddenRussell LangJeff SigafoosBibi Huskens","2014","http://link.springer.com/article/10.1007/s40489-013-0008-z","Article"
"A case for the role of memory consolidation in speech-motor learning","Psychonomic Bulletin & Review","","28","1","10.3758/s13423-020-01793-w","Anne L. van ZelstF. Sayako Earle","2021","http://link.springer.com/article/10.3758/s13423-020-01793-w","Article"
"Sensory processing profile among a sample of Egyptian children with different types of delayed language development: correlations of different variables","The Egyptian Journal of Otolaryngology","","40","1","10.1186/s43163-023-00554-5","Hassnaa Othman MohammedShimaa Abd Allah ElsayedNesreen Fathi Mahmoud","2024","http://link.springer.com/article/10.1186/s43163-023-00554-5","Article"
"Effects of intelligibility on working memory demand for speech perception","Attention, Perception, & Psychophysics","","71","6","10.3758/APP.71.6.1360","Alexander L. FrancisHoward C. Nusbaum","2009","http://link.springer.com/article/10.3758/APP.71.6.1360","Article"
"Abstracts of the 17th Congress of the European Geriatric Medicine Society","European Geriatric Medicine","","12","1","10.1007/s41999-021-00585-2","","2021","http://link.springer.com/article/10.1007/s41999-021-00585-2","Article"
"11th ESSD Congress, 2021","Dysphagia","","38","1","10.1007/s00455-022-10456-y","","2023","http://link.springer.com/article/10.1007/s00455-022-10456-y","Article"
"Sound-meaning associations allow listeners to infer the meaning of foreign language words","Communications Psychology","","1","1","10.1038/s44271-023-00030-z","Sayuri HayakawaViorica Marian","2023","http://link.springer.com/article/10.1038/s44271-023-00030-z","Article"
"A multi-study examination of the role of repeated spaced retrieval in the word learning of children with developmental language disorder","Journal of Neurodevelopmental Disorders","","13","1","10.1186/s11689-021-09368-z","Laurence B. LeonardSharon L. ChristPatricia DeevyJeffrey D. KarpickeChristine WeberEileen HaebigJustin B. KueserSofía SoutoWindi Krok","2021","http://link.springer.com/article/10.1186/s11689-021-09368-z","Article"
"Emerging Verbal Functions in Early Infancy: Lessons from Observational and Computational Approaches on Typical Development and Neurodevelopmental Disorders","Advances in Neurodevelopmental Disorders","","6","4","10.1007/s41252-022-00300-7","Peter B. MarschikClaudius A. A. WidmannSigrun LangTomas KulviciusSofie BoterbergKarin Nielsen-SainesSven BölteGianluca EspositoAnders Nordahl-HansenHerbert RoeyersFlorentin WörgötterChrista EinspielerLuise PoustkaDajie Zhang","2022","http://link.springer.com/article/10.1007/s41252-022-00300-7","Article"
"The language-related transcription factor FOXP2 is post-translationally modified with small ubiquitin-like modifiers","Scientific Reports","","6","1","10.1038/srep20911","Sara B. EstruchSarah A. GrahamPelagia DeriziotisSimon E. Fisher","2016","http://link.springer.com/article/10.1038/srep20911","Article"
"Using Social Media Categorical Reactions as a Gateway to Identify Hate Speech in COVID-19 News","SN Computer Science","","4","1","10.1007/s42979-022-01421-5","Luciana OliveiraJoana Azevedo","2022","http://link.springer.com/article/10.1007/s42979-022-01421-5","Article"
"Overnight changes to dual-memory processes reflected in speech-perceptual performance","Attention, Perception, & Psychophysics","","84","1","10.3758/s13414-021-02418-7","F. Sayako EarleZhenghan Qi","2022","http://link.springer.com/article/10.3758/s13414-021-02418-7","Article"
"Watch your language!","Genome Biology","","2","1","10.1186/gb-spotlight-20011005-01","Jonathan B Weitzman","2001","http://link.springer.com/article/10.1186/gb-spotlight-20011005-01","Article"
"Speech therapy, new developments and results in LingWare","Computers for Handicapped Persons","","","","10.1007/3-540-58476-5_154","Wolfgang GrießlF. J. Stachowiak","1994","http://link.springer.com/chapter/10.1007/3-540-58476-5_154","Chapter"
"Psychiatric illness and regression in individuals with Phelan-McDermid syndrome","Journal of Neurodevelopmental Disorders","","12","1","10.1186/s11689-020-9309-6","Teresa M. KohlenbergM. Pilar TrellesBrittany McLarneyCatalina BetancurAudrey ThurmAlexander Kolevzon","2020","http://link.springer.com/article/10.1186/s11689-020-9309-6","Article"
"Enhanced production and perception of musical pitch in tone language speakers","Attention, Perception, & Psychophysics","","71","6","10.3758/APP.71.6.1385","Peter Q. PfordresherSteven Brown","2009","http://link.springer.com/article/10.3758/APP.71.6.1385","Article"
"Acoustic characteristics of voice and speech in Arabic-speaking stuttering children","The Egyptian Journal of Otolaryngology","","38","1","10.1186/s43163-021-00192-9","Marwa ElsherbenyHemmat BazOmayma Afsah","2022","http://link.springer.com/article/10.1186/s43163-021-00192-9","Article"
"Audit on Autistic Spectrum Disorder (April 2006 to April 2007)","Pediatric Research","","70","5","10.1038/pr.2011.819","V Venugopalan","2011","http://link.springer.com/article/10.1038/pr.2011.819","Article"
"SSIEM 2014 Annual Symposium: Abstracts","Journal of Inherited Metabolic Disease","","37","1","10.1007/s10545-014-9740-5","","2014","http://link.springer.com/article/10.1007/s10545-014-9740-5","Article"
"Towards an Arabic Language Augmentative and Alternative Communication Application for Autism","Design, User Experience, and Usability. Health, Learning, Playing, Cultural, and Cross-Cultural User Experience","","","","10.1007/978-3-642-39241-2_37","Bayan Al-ArifiArwa Al-RubaianGhadah Al-OfisanNorah Al-RomiAreej Al-Wabil","2013","http://link.springer.com/chapter/10.1007/978-3-642-39241-2_37","Chapter"
"Abstracts of the 2011 International MASCC/ISOO Symposium","Supportive Care in Cancer","","19","2","10.1007/s00520-011-1184-y","","2011","http://link.springer.com/article/10.1007/s00520-011-1184-y","Article"
"Processing emotional prosody in a foreign language: the case of German and Hebrew","Journal of Cultural Cognitive Science","","6","3","10.1007/s41809-022-00107-x","Vered ShakufBoaz Ben-DavidThomas G. G. WegnerPatricia B. C. WesselingMaya MentzelSabrina DefrenShanley E. M. AllenThomas Lachmann","2022","http://link.springer.com/article/10.1007/s41809-022-00107-x","Article"
"Effortful speech with distortion of prosody following SARS-CoV-2 infection","Neurological Sciences","","41","12","10.1007/s10072-020-04603-2","Maria Sofia CotelliMaria CotelliFilippo ManelliGraziella BonettiRenata RaoAlessandro PadovaniBarbara Borroni","2020","http://link.springer.com/article/10.1007/s10072-020-04603-2","Article"
"Cognitive and Behavioural Weaknesses in Children with Reading Disorder and AD(H)D","Scientific Reports","","9","1","10.1038/s41598-019-51372-w","Sabrina TurkerAnnemarie Seither-PreislerSusanne Maria ReitererPeter Schneider","2019","http://link.springer.com/article/10.1038/s41598-019-51372-w","Article"
"Nonword repetition in specific language impairment: More than a phonological short-term memory deficit","Psychonomic Bulletin & Review","","14","5","10.3758/BF03194122","Lisa M. D. ArchibaldSusan E. Gathercole","2007","http://link.springer.com/article/10.3758/BF03194122","Article"
"An algorithm for Parkinson’s disease speech classification based on isolated words analysis","Health Information Science and Systems","","9","1","10.1007/s13755-021-00162-8","Federica AmatoLuigi BorzìGabriella OlmoJuan Rafael Orozco-Arroyave","2021","http://link.springer.com/article/10.1007/s13755-021-00162-8","Article"
"Lifestyle profile of school-aged children suffering from pathological stuttering","The Egyptian Journal of Otolaryngology","","31","1","10.4103/1012-5574.152711","Rahma S. BhgatMohamed E. Darweesh MDMervat A. Ahmed","2015","http://link.springer.com/article/10.4103/1012-5574.152711","Article"
"An automatic speech analytics program for digital assessment of stress burden and psychosocial health","npj Mental Health Research","","2","1","10.1038/s44184-023-00036-9","Amanda M. Y. ChuBenson S. Y. LamJenny T. Y. TsangAgnes TiwariHelina YukJacky N. L. ChanMike K. P. So","2023","http://link.springer.com/article/10.1038/s44184-023-00036-9","Article"
"The Narrative Subject","","","","","10.1007/978-3-030-51189-0","Christina Schachtner","2020","http://link.springer.com/book/10.1007/978-3-030-51189-0","Book"
"Presented Abstracts from the Thirty Fourth Annual Education Conference of the National Society of Genetic Counselors (Pittsburgh, PA, October 2015)","Journal of Genetic Counseling","","24","6","10.1007/s10897-015-9893-x","Beverly M. YasharEmily EdelmanKatie DarinZuri McClelland","2015","http://link.springer.com/article/10.1007/s10897-015-9893-x","Article"
"Automatic speech recognition in neurodegenerative disease","International Journal of Speech Technology","","24","3","10.1007/s10772-021-09836-w","Benjamin G. SchultzVenkata S. Aditya TarigoppulaGustavo NoffsSandra RojasAnneke van der WaltDavid B. GraydenAdam P. Vogel","2021","http://link.springer.com/article/10.1007/s10772-021-09836-w","Article"
"Evaluating ‘enhancing pragmatic language skills for young children with social communication impairments’ (E-PLAYS): protocol for a feasibility randomised controlled trial study","Pilot and Feasibility Studies","","5","1","10.1186/s40814-019-0456-z","Suzanne MurphyVictoria JoffeDavid MesserSarah CrafterJessica RadleySailaa SunthararajahKerry BellBelen CorbachoCaroline FairhurstSara RodgersDavid TorgersonCharlie Welch","2019","http://link.springer.com/article/10.1186/s40814-019-0456-z","Article"
"Thought disorder is correlated with atypical spoken binomial orderings","Schizophrenia","","8","1","10.1038/s41537-022-00238-8","Michael MurphyDost Öngür","2022","http://link.springer.com/article/10.1038/s41537-022-00238-8","Article"
"Demystifying the Role of Natural Language Processing (NLP) in Smart City Applications: Background, Motivation, Recent Advances, and Future Research Directions","Wireless Personal Communications","","130","2","10.1007/s11277-023-10312-8","Nemika TyagiBharat Bhushan","2023","http://link.springer.com/article/10.1007/s11277-023-10312-8","Article"
"Phenotypic differences between female and male individuals with suspicion of autism spectrum disorder","Molecular Autism","","13","1","10.1186/s13229-022-00491-9","Sanna StrothJohannes TauscherNicole WolffCharlotte KüpperLuise PoustkaStefan RoepkeVeit RoessnerDominik HeiderInge Kamp-Becker","2022","http://link.springer.com/article/10.1186/s13229-022-00491-9","Article"
"Automatic disambiguation of morphosyntax in spoken language corpora","Behavior Research Methods, Instruments, & Computers","","32","3","10.3758/BF03200818","Christophe ParisseMarie-thérèse Le Normand","2000","http://link.springer.com/article/10.3758/BF03200818","Article"
"Efficacy of Behavioral Interventions for Young Children with Autism Spectrum Disorders: Public Policy, the Evidence Base, and Implementation Parameters","Review Journal of Autism and Developmental Disorders","","1","4","10.1007/s40489-014-0025-6","Raymond G. RomanczykEmily H. CallahanLaura B. TurnerRachel N. S. Cavalari","2014","http://link.springer.com/article/10.1007/s40489-014-0025-6","Article"
"Dissecting neural computations in the human auditory pathway using deep neural networks for speech","Nature Neuroscience","","26","12","10.1038/s41593-023-01468-4","Yuanning LiGopala K. AnumanchipalliAbdelrahman MohamedPeili ChenLaurel H. CarneyJunfeng LuJinsong WuEdward F. Chang","2023","http://link.springer.com/article/10.1038/s41593-023-01468-4","Article"
"Abstracts from the ICBM 2012 Meeting","International Journal of Behavioral Medicine","","19","1","10.1007/s12529-012-9247-0","","2012","http://link.springer.com/article/10.1007/s12529-012-9247-0","Article"
"Characteristics of language impairment in Parkinson’s disease and its influencing factors","Translational Neurodegeneration","","4","1","10.1186/2047-9158-4-2","Lin LiuXiao-Guang LuoChui-Liang DyYan RenYu FengHong-Mei YuHong ShangZhi-Yi He","2015","http://link.springer.com/article/10.1186/2047-9158-4-2","Article"
"A preliminary demonstration of exemplar-based voice conversion for articulation disorders using an individuality-preserving dictionary","EURASIP Journal on Audio, Speech, and Music Processing","","2014","1","10.1186/1687-4722-2014-5","Ryo AiharaRyoichi TakashimaTetsuya TakiguchiYasuo Ariki","2014","http://link.springer.com/article/10.1186/1687-4722-2014-5","Article"
"Cochlear Implant Considerations in Children with Additional Disabilities","Current Otorhinolaryngology Reports","","1","2","10.1007/s40136-013-0011-z","C. Eduardo CorralesJohn S. Oghalai","2013","http://link.springer.com/article/10.1007/s40136-013-0011-z","Article"
"Language delay aggregates in toddler siblings of children with autism spectrum disorder","Journal of Neurodevelopmental Disorders","","10","1","10.1186/s11689-018-9247-8","N MarrusL P HallS J PatersonJ T ElisonJ J WolffM R SwansonJ Parish-MorrisA T EggebrechtJ R Pruett Jr.H C HazlettL ZwaigenbaumS DagerA M EstesR T SchultzK N BotteronJ Piven","2018","http://link.springer.com/article/10.1186/s11689-018-9247-8","Article"
"Abstracts","Underwater Medicine and Related Sciences","","","","10.1007/978-1-4684-8500-4_1","Charles W. ShillingMargaret F. Werts","1973","http://link.springer.com/chapter/10.1007/978-1-4684-8500-4_1","Chapter"
"Puffy: A Mobile Inflatable Interactive Companion for Children with Neurodevelopmental Disorder","Human-Computer Interaction - INTERACT 2017","","","","10.1007/978-3-319-67684-5_29","Franca GarzottoMirko GelsominiYosuke Kinoe","2017","http://link.springer.com/chapter/10.1007/978-3-319-67684-5_29","Chapter"
"Speech","Encyclopedia of Clinical Neuropsychology","","","","10.1007/978-3-319-56782-2_923-3","Lyn S. Turkstra","2018","http://link.springer.com/referenceworkentry/10.1007/978-3-319-56782-2_923-3","ReferenceWorkEntry"
"Autorenregister","medizinische genetik","","29","1","10.1007/s11825-017-0126-6","","2017","http://link.springer.com/article/10.1007/s11825-017-0126-6","Article"
"Complex nature of apparently balanced chromosomal rearrangements in patients with autism spectrum disorder","Molecular Autism","","6","1","10.1186/s13229-015-0015-2","Anne-Claude TabetAlain VerloesMarion PilorgeElsa DelabyRichard DelormeGudrun NygrenFrançoise DevillardMarion GérardSandrine PassemardDelphine HéronJean-Pierre SiffroiAurelia JacquetteAndrée DelahayeLaurence PerrinCéline DupontAzzedine Aboura","2015","http://link.springer.com/article/10.1186/s13229-015-0015-2","Article"
"Relationship between individual differences in speech processing and cognitive functions","Psychonomic Bulletin & Review","","22","6","10.3758/s13423-015-0839-y","Jinghua OuSam-Po LawRoxana Fung","2015","http://link.springer.com/article/10.3758/s13423-015-0839-y","Article"
