Item Title,Publication Title,Book Series Title,Journal Volume,Journal Issue,Item DOI,Authors,Publication Year,URL,Content Type
"Metabolic effects of sapropterin treatment in autism spectrum disorder: a preliminary study","Translational Psychiatry","","3","3","10.1038/tp.2013.14","R E FryeR DeLaTorreH B TaylorJ SlatteryS MelnykN ChowdhuryS J James","2013","http://link.springer.com/article/10.1038/tp.2013.14","Article"
"Examining the autistic traits in children and adolescents diagnosed with attention-deficit hyperactivity disorder and their parents","BMC Psychiatry","","20","1","10.1186/s12888-020-02703-z","Esra OkyarIşık Görker","2020","http://link.springer.com/article/10.1186/s12888-020-02703-z","Article"
"Abstracts 2014","Annals of Behavioral Medicine","","47","1","10.1007/s12160-014-9596-9","","2014","http://link.springer.com/article/10.1007/s12160-014-9596-9","Article"
"ACNP 55th Annual Meeting: Poster Session III","Neuropsychopharmacology","","41","1","10.1038/npp.2016.242","","2016","http://link.springer.com/article/10.1038/npp.2016.242","Article"
"Creating a Robot-Supported Education Solution for Children with Autism Spectrum Disorder","Computers Helping People with Special Needs","","","","10.1007/978-3-031-08645-8_25","Trenton SchulzKristin Skeide Fuglerud","2022","http://link.springer.com/chapter/10.1007/978-3-031-08645-8_25","Chapter"
"Observational and Reported Measures of Language and Pragmatics in Young People with Autism: A Comparison of Respondent Data and Gender Profiles","Journal of Autism and Developmental Disorders","","50","3","10.1007/s10803-019-04288-3","Alexandra SturrockAntonia MarsdenCatherine AdamsJenny Freed","2020","http://link.springer.com/article/10.1007/s10803-019-04288-3","Article"
"Optimising Emotions, Incubating Falsehoods","","","","","10.1007/978-3-031-13551-4","Vian BakirAndrew McStay","2022","http://link.springer.com/book/10.1007/978-3-031-13551-4","Book"
"Neural systems mediating processing of sound units of language distinguish recovery versus persistence in stuttering","Journal of Neurodevelopmental Disorders","","7","1","10.1186/s11689-015-9124-7","Ranjini MohanChristine Weber","2015","http://link.springer.com/article/10.1186/s11689-015-9124-7","Article"
"Lithium as a rescue therapy for regression and catatonia features in two SHANK3 patients with autism spectrum disorder: case reports","BMC Psychiatry","","15","1","10.1186/s12888-015-0490-1","Sylvie SerretSusanne ThümmlerEmmanuelle DorStephanie VesperiniAndreia SantosFlorence Askenazy","2015","http://link.springer.com/article/10.1186/s12888-015-0490-1","Article"
"Poster Session II","Neuropsychopharmacology","","30","1","10.1038/sj.npp.1300970","","2005","http://link.springer.com/article/10.1038/sj.npp.1300970","Article"
"Bilingual children acquiring Russian and German in Vienna: nonword repetition correlates with stronger but not with weaker language","neuropsychiatrie","","37","3","10.1007/s40211-023-00456-1","Brigitte EisenwortMaksim TilisCarolin SchmidGabriela Diendorfer-Radner","2023","http://link.springer.com/article/10.1007/s40211-023-00456-1","Article"
"Mission AI","Research for Policy","","","","10.1007/978-3-031-21448-6","Haroon SheikhCorien PrinsErik Schrijvers","2023","http://link.springer.com/book/10.1007/978-3-031-21448-6","Book"
"Long-term outcome of autistic spectrum disorder: a retrospective case study in a southern italian region","Italian Journal of Pediatrics","","43","1","10.1186/s13052-017-0399-z","Francesca Felicia OpertoFederica MartinoAnnalisa RinaldiAngelo CerracchioGiovanni SalvatiMariano OrzaClaudia LemboGianvito PanzarinoClaudia Di PaolantonioAlberto VerrottiGiovanni FarelloGiangennaro Coppola","2017","http://link.springer.com/article/10.1186/s13052-017-0399-z","Article"
"ACNP 55th Annual Meeting: Poster Session II","Neuropsychopharmacology","","41","1","10.1038/npp.2016.241","","2016","http://link.springer.com/article/10.1038/npp.2016.241","Article"
"I am Alexa, your virtual tutor!: The effects of Amazon Alexa’s text-to-speech voice enthusiasm in a multimedia learning environment","Education and Information Technologies","","28","2","10.1007/s10639-022-11255-6","Tze Wei LiewSu-Mae TanWei Ming PangMohammad Tariqul Islam KhanSi Na Kew","2023","http://link.springer.com/article/10.1007/s10639-022-11255-6","Article"
"Further evidence for a parent-of-origin effect at the NOP9 locus on language-related phenotypes","Journal of Neurodevelopmental Disorders","","8","1","10.1186/s11689-016-9157-6","Kerry A. PettigrewEmily FrintonRon NudelMay T. M. ChanPaul ThompsonMarianna E. Hayiou-ThomasJoel B. TalcottJohn SteinAnthony P. MonacoCharles HulmeMargaret J. SnowlingDianne F. NewburySilvia Paracchini","2016","http://link.springer.com/article/10.1186/s11689-016-9157-6","Article"
"Language production and working memory in classic galactosemia from a cognitive neuroscience perspective: future research directions","Journal of Inherited Metabolic Disease","","34","2","10.1007/s10545-010-9266-4","Inge TimmersJob van den HurkFrancesco Di SalleM. Estela Rubio-GozalboBernadette M. Jansma","2011","http://link.springer.com/article/10.1007/s10545-010-9266-4","Article"
"Clinical evaluation of rare copy number variations identified by chromosomal microarray in a Hungarian neurodevelopmental disorder patient cohort","Molecular Cytogenetics","","15","1","10.1186/s13039-022-00623-z","Anna LengyelÉva PintiHenriett PikóÁrvai KristófTünde AbonyiZaránd NémethiGyörgy FeketeIrén Haltrich","2022","http://link.springer.com/article/10.1186/s13039-022-00623-z","Article"
"Predictors of language and auditory skills in Egyptian children with a cochlear implant","The Egyptian Journal of Otolaryngology","","31","3","10.4103/1012-5574.161605","Asmaa Abdel HamidMohammed ElshazlyTarek EldessoukyHosam Abdel GhaffarAhmed RadwanAhmed Abdel Monem","2015","http://link.springer.com/article/10.4103/1012-5574.161605","Article"
"Training non-native speech contrasts in adults: Acquisition of the English /ð/-/θ/ contrast by francophones","Perception & Psychophysics","","40","4","10.3758/BF03211500","Donald G. JamiesonDavid E. Morosan","1986","http://link.springer.com/article/10.3758/BF03211500","Article"
"A high-performance speech neuroprosthesis","Nature","","620","7976","10.1038/s41586-023-06377-x","Francis R. WillettErin M. KunzChaofei FanDonald T. AvansinoGuy H. WilsonEun Young ChoiForam KamdarMatthew F. GlasserLeigh R. HochbergShaul DruckmannKrishna V. ShenoyJaimie M. Henderson","2023","http://link.springer.com/article/10.1038/s41586-023-06377-x","Article"
"A boy with conduct disorder (CD), attention deficit hyperactivity disorder (ADHD), borderline intellectual disability, and 47,XXY syndrome in combination with a 7q11.23 duplication, 11p15.5 deletion, and 20q13.33 deletion","Child and Adolescent Psychiatry and Mental Health","","10","1","10.1186/s13034-016-0121-8","Gerasimos KolaitisChristian G. BouwkampAlexia PapakonstantinouIoanna OtheitiMaria BelivanakiStyliani HaritakiTerpsihori KorpaZinovia AlbaniElena TerzioglouPolyxeni ApostolaAggeliki SkamnakiAthena XaidaraKonstantina KosmaSophia Kitsiou-TzeliMaria Tzetis","2016","http://link.springer.com/article/10.1186/s13034-016-0121-8","Article"
"The Sabancı University Dynamic Face Database (SUDFace): Development and validation of an audiovisual stimulus set of recited and free speeches with neutral facial expressions","Behavior Research Methods","","55","6","10.3758/s13428-022-01951-z","Yağmur Damla ŞentürkEbru Ecem Tavaciogluİlker DuymazBilge SayimNihan Alp","2023","http://link.springer.com/article/10.3758/s13428-022-01951-z","Article"
"My Lovely Granny’s Farm: An immersive virtual reality training system for children with autism spectrum disorder","Education and Information Technologies","","28","12","10.1007/s10639-023-11862-x","Aiganym SoltiyevaWilk OliveiraAlimanova MadinaShyngys AdilkhanMarat UrmanovJuho Hamari","2023","http://link.springer.com/article/10.1007/s10639-023-11862-x","Article"
"Poster Session II","Neuropsychopharmacology","","39","1","10.1038/npp.2014.281","","2014","http://link.springer.com/article/10.1038/npp.2014.281","Article"
"Social skills interventions for Thai adolescents with Autism Spectrum Disorder (ASD): a qualitative study of the perceptions and experiences of Thai adolescents, their caregivers and healthcare professionals","International Journal of Mental Health Systems","","18","1","10.1186/s13033-023-00617-3","Nadlada TawankanjanachotMaria TruesdalePornpun OrachonLisa Kidd","2024","http://link.springer.com/article/10.1186/s13033-023-00617-3","Article"
"A computational approach to measure the linguistic characteristics of psychotherapy timing, responsiveness, and consistency","npj Mental Health Research","","1","1","10.1038/s44184-022-00020-9","Adam S. MinerScott L. FlemingAlbert HaqueJason A. FriesTim AlthoffDenise E. WilfleyW. Stewart AgrasArnold MilsteinJeff HancockSteven M. AschShannon Wiltsey StirmanBruce A. ArnowNigam H. Shah","2022","http://link.springer.com/article/10.1038/s44184-022-00020-9","Article"
"Structural connectivity in ventral language pathways characterizes non-verbal autism","Brain Structure and Function","","227","5","10.1007/s00429-022-02474-1","Guillem OlivéDominika SlušnáLucía VaqueroJordi Muchart-LópezAntoni Rodríguez-FornellsWolfram Hinzen","2022","http://link.springer.com/article/10.1007/s00429-022-02474-1","Article"
"Developmental and sequenced one-to-one educational intervention (DS1-EI) for autism spectrum disorder and intellectual disability: a two-year interim report of a randomized single-blind multicenter controlled trial","BMC Pediatrics","","20","1","10.1186/s12887-020-02156-z","Antoine TanetAnnick Hubert-BarthelemyMarie-Noëlle ClémentFrançois SoumilleGraciela C. CrespinHugues PellerinFrançois-André AllaertDavid CohenCatherine Saint-Georges","2020","http://link.springer.com/article/10.1186/s12887-020-02156-z","Article"
"The development of voicing categories: A quantitative review of over 40 years of infant speech perception research","Psychonomic Bulletin & Review","","21","4","10.3758/s13423-013-0569-y","Marcus E. GalleBob McMurray","2014","http://link.springer.com/article/10.3758/s13423-013-0569-y","Article"
"The effects of a surgical mask and an N95 mask on intelligibility of explicit and ambiguous speech produced in the operating room environment","Anesthesiology and Perioperative Science","","2","1","10.1007/s44254-023-00041-3","Hidemi IshidoRieko OishiYuki YamazakiSatoki Inoue","2024","http://link.springer.com/article/10.1007/s44254-023-00041-3","Article"
"Abstract","Annals of Behavioral Medicine","","41","1","10.1007/s12160-011-9263-3","","2011","http://link.springer.com/article/10.1007/s12160-011-9263-3","Article"
"Definition of the neurological phenotype associated with dup (X)(p11.22–p11.23)","Epileptic Disorders","","13","3","10.1684/epd.2011.0462","Marcella BroliFrancesca BisulliMassimo MastrangeloElena FontanaIsabella FiocchiClaudio ZuccaMaria Clara BonagliaSerafino BuonoSebastiano Antonino MusumeciCorrado RomanoSantina ReitanoMaria SavioGirolamo Aurelio VitelloBruno BernardiDaniela CevolaniRaffaele Agati","2011","http://link.springer.com/article/10.1684/epd.2011.0462","Article"
"Case management of a person with disorders of language and identification of case managers in rehabilitation","BMC Geriatrics","","10","1","10.1186/1471-2318-10-S1-L80","V Piraino","2010","http://link.springer.com/article/10.1186/1471-2318-10-S1-L80","Article"
"Speech auditory brainstem responses (s-ABRs) as a new approach for the assessment of speech sounds coding","The Egyptian Journal of Otolaryngology","","40","1","10.1186/s43163-024-00562-z","Hagar Ahmed ElsayedEbtessam Hamed NadaDalia Helal GalhoumNadia Mohamed Elnabtity","2024","http://link.springer.com/article/10.1186/s43163-024-00562-z","Article"
"Indices for the determination of the degree of communication skills improvement in prelingual children with cochlear implantation","The Egyptian Journal of Otolaryngology","","32","4","10.4103/1012-5574.192553","Manal El-Banna BSc, MSc, MDGamal Youssef","2016","http://link.springer.com/article/10.4103/1012-5574.192553","Article"
"ACNP 56th Annual Meeting: Poster Session III, December 6, 2017","Neuropsychopharmacology","","42","1","10.1038/npp.2017.266","","2017","http://link.springer.com/article/10.1038/npp.2017.266","Article"
"Current state of knowledge on the prevalence of neurodevelopmental disorders in childhood according to the DSM-5: a systematic review in accordance with the PRISMA criteria","Child and Adolescent Psychiatry and Mental Health","","16","1","10.1186/s13034-022-00462-1","Lorena FrancésJavier QuinteroAlberto FernándezAntoni RuizJessica CaulesGabriella FillonAmaia HervásC. Virgínia Soler","2022","http://link.springer.com/article/10.1186/s13034-022-00462-1","Article"
"ACCEPTED ABSTRACTS for the American Academy of Pediatric Neuropsychology (AAPdN) Virtual Conference 2021","Journal of Pediatric Neuropsychology","","7","3","10.1007/s40817-021-00098-7","","2021","http://link.springer.com/article/10.1007/s40817-021-00098-7","Article"
"Autism spectrum disorder in Phelan-McDermid syndrome: initial characterization and genotype-phenotype correlations","Orphanet Journal of Rare Diseases","","10","1","10.1186/s13023-015-0323-9","Lindsay M. ObermanLuigi BoccutoLauren CascioSara SarasuaWalter E. Kaufmann","2015","http://link.springer.com/article/10.1186/s13023-015-0323-9","Article"
"Functional characterization of TBR1 variants in neurodevelopmental disorder","Scientific Reports","","8","1","10.1038/s41598-018-32053-6","Joery den HoedElliot SollisHanka VenselaarSara B. EstruchPelagia DeriziotisSimon E. Fisher","2018","http://link.springer.com/article/10.1038/s41598-018-32053-6","Article"
"STXBP1-associated neurodevelopmental disorder: a comparative study of behavioural characteristics","Journal of Neurodevelopmental Disorders","","11","1","10.1186/s11689-019-9278-9","Sinéad O’BrienElise Ng-CordellDuncan E. AstleGaia ScerifKate Baker","2019","http://link.springer.com/article/10.1186/s11689-019-9278-9","Article"
"Augmentative and alternative communication in children with Down’s syndrome: a systematic review","BMC Pediatrics","","18","1","10.1186/s12887-018-1144-5","Renata Thaís de Almeida BarbosaAcary Souza Bulle de OliveiraJennifer Yohanna Ferreira de Lima AntãoTânia Brusque CrocettaRegiani GuarnieriThaiany Pedrozo Campos AntunesClaudia ArabThaís MassettiItalla Maria Pinheiro BezerraCarlos Bandeira de Mello MonteiroLuiz Carlos de Abreu","2018","http://link.springer.com/article/10.1186/s12887-018-1144-5","Article"
"Simplex Society","","","","","10.1007/978-3-031-41115-1","Koen Stroeken","2024","http://link.springer.com/book/10.1007/978-3-031-41115-1","Book"
"Effect of Television Exposure on Attention and Language in Preschool Children","The Egyptian Journal of Otolaryngology","","35","3","10.4103/ejo.ejo_47_18","Eman Mostafa MD, PhD","2019","http://link.springer.com/article/10.4103/ejo.ejo_47_18","Article"
"Sch-net: a deep learning architecture for automatic detection of schizophrenia","BioMedical Engineering OnLine","","20","1","10.1186/s12938-021-00915-2","Jia FuSen YangFei HeLing HeYuanyuan LiJing ZhangXi Xiong","2021","http://link.springer.com/article/10.1186/s12938-021-00915-2","Article"
"Cognitive functions in Arabic-speaking children with velopharyngeal insufficiency and their impact on speech intelligibility","The Egyptian Journal of Otolaryngology","","39","1","10.1186/s43163-023-00500-5","Essam-Eldin M. ArefZeinab A. Abdel HameedHanan A. Mohamed","2023","http://link.springer.com/article/10.1186/s43163-023-00500-5","Article"
"A review of functional and structural neuroimaging studies to investigate the inner speech model of auditory verbal hallucinations in schizophrenia","Translational Psychiatry","","11","1","10.1038/s41398-021-01670-7","Liam BarberRenate ReniersRachel Upthegrove","2021","http://link.springer.com/article/10.1038/s41398-021-01670-7","Article"
"Reading and lexical–semantic retrieval tasks outperforms single task speech analysis in the screening of mild cognitive impairment and Alzheimer's disease","Scientific Reports","","13","1","10.1038/s41598-023-36804-y","Israel Martínez-NicolásFrancisco Martínez-SánchezOlga IvanovaJuan J. G. Meilán","2023","http://link.springer.com/article/10.1038/s41598-023-36804-y","Article"
"An open resource for transdiagnostic research in pediatric mental health and learning disorders","Scientific Data","","4","1","10.1038/sdata.2017.181","Lindsay M. AlexanderJasmine EscaleraLei AiCharissa AndreottiKarina FebreAlexander MangoneNatan Vega-PotlerNicolas LangerAlexis AlexanderMeagan KovacsShannon LitkeBridget O'HaganJennifer AndersenBatya BronsteinAnastasia BuiMarijayne Bushey","2017","http://link.springer.com/article/10.1038/sdata.2017.181","Article"
"Immunoregulatory and/or Anti-inflammatory Agents for the Management of Core and Associated Symptoms in Individuals with Autism Spectrum Disorder: A Narrative Review of Randomized, Placebo-Controlled Trials","CNS Drugs","","37","3","10.1007/s40263-023-00993-x","Gara Arteaga-HenríquezLaura GisbertJosep Antoni Ramos-Quiroga","2023","http://link.springer.com/article/10.1007/s40263-023-00993-x","Article"
"Naturalistic Developmental Behavioral Interventions: Empirically Validated Treatments for Autism Spectrum Disorder","Journal of Autism and Developmental Disorders","","45","8","10.1007/s10803-015-2407-8","Laura SchreibmanGeraldine DawsonAubyn C. StahmerRebecca LandaSally J. RogersGail G. McGeeConnie KasariBrooke IngersollAnn P. KaiserYvonne BruinsmaErin McNerneyAmy WetherbyAlycia Halladay","2015","http://link.springer.com/article/10.1007/s10803-015-2407-8","Article"
"Poster Session III","Neuropsychopharmacology","","40","1","10.1038/npp.2015.327","","2015","http://link.springer.com/article/10.1038/npp.2015.327","Article"
"HNS - Head and Neck Surgery, Larynx and Others","European Archives of Oto-Rhino-Laryngology","","264","1","10.1007/s00405-007-0344-7","","2007","http://link.springer.com/article/10.1007/s00405-007-0344-7","Article"
"Features and effects of computer-based games on cognitive impairments in children with autism spectrum disorder: an evidence-based systematic literature review","BMC Psychiatry","","23","1","10.1186/s12888-022-04501-1","Sorayya RezayiMehdi Tehrani-DoostLeila Shahmoradi","2023","http://link.springer.com/article/10.1186/s12888-022-04501-1","Article"
"The perception of intonational and emotional speech prosody produced with and without a face mask: an exploratory individual differences study","Cognitive Research: Principles and Implications","","7","1","10.1186/s41235-022-00439-w","Chloe SinagraSeth Wiener","2022","http://link.springer.com/article/10.1186/s41235-022-00439-w","Article"
"Gain-of-function mutations in KCNK3 cause a developmental disorder with sleep apnea","Nature Genetics","","54","10","10.1038/s41588-022-01185-x","Janina SörmannMarcus SchewePeter ProksThibault Jouen-TachoireShanlin RaoElena B. RielKatherine E. AgreAmber BegtrupJohn DeanMaria DescartesJan FischerAlice GardhamCarrie LahnerPaul R. MarkSrikanth MuppidiPavel N. Pichurin","2022","http://link.springer.com/article/10.1038/s41588-022-01185-x","Article"
"Predicting clinical scores in Huntington’s disease: a lightweight speech test","Journal of Neurology","","269","9","10.1007/s00415-022-11148-1","Rachid RiadMarine LunvenHadrien TiteuxXuan-Nga CaoJennifer Hamet BagnouLaurie LemoineJustine MontillotAgnes SliwinskiKatia YoussovLaurent Cleret de LangavantEmmanuel DupouxAnne-Catherine Bachoud-Lévi","2022","http://link.springer.com/article/10.1007/s00415-022-11148-1","Article"
"Perception of synthetic speech produced automatically by rule: Intelligibility of eight text-to-speech systems","Behavior Research Methods, Instruments, & Computers","","18","2","10.3758/BF03201008","Beth G. GreeneJohn S. LoganDavid B. Pisoni","1986","http://link.springer.com/article/10.3758/BF03201008","Article"
"Comparison of voice acquisition methodologies in speech research","Behavior Research Methods","","40","4","10.3758/BRM.40.4.982","Adam P. VogelPaul Maruff","2008","http://link.springer.com/article/10.3758/BRM.40.4.982","Article"
"Acoustic analysis and detection of pharyngeal fricative in cleft palate speech using correlation of signals in independent frequency bands and octave spectrum prominent peak","BioMedical Engineering OnLine","","19","1","10.1186/s12938-020-00782-3","Fei HeXiyue WangHeng YinHan ZhangGang YangLing He","2020","http://link.springer.com/article/10.1186/s12938-020-00782-3","Article"
"DayByDay: Interactive and Customizable Use of Mobile Technology in the Cognitive Development Process of Children with Autistic Spectrum Disorder","Universal Access in Human-Computer Interaction. Universal Access to Information and Knowledge","","","","10.1007/978-3-319-07440-5_41","Vanessa Tavares de Oliveira BarrosCristiane Affonso de Almeida ZerbettoKátia Tavares MeserlianRodolfo BarrosMurilo Crivellari CamargoTáthia Cristina Passos de Carvalho","2014","http://link.springer.com/chapter/10.1007/978-3-319-07440-5_41","Chapter"
"Narratives of the Unspoken in Contemporary Irish Fiction","New Directions in Irish and Irish American Literature","","","","10.1007/978-3-031-30455-2","M. Teresa Caneda-CabreraJosé Carregal-Romero","2023","http://link.springer.com/book/10.1007/978-3-031-30455-2","Book"
"ERP mismatch response to phonological and temporal regularities in speech","Scientific Reports","","10","1","10.1038/s41598-020-66824-x","Alexandra K. EmmendorferJoao M. CorreiaBernadette M. JansmaSonja A. KotzMilene Bonte","2020","http://link.springer.com/article/10.1038/s41598-020-66824-x","Article"
"Development and testing of a game-based digital intervention for working memory training in autism spectrum disorder","Scientific Reports","","11","1","10.1038/s41598-021-93258-w","Surbhit WagleArka GhoshP. KarthicAkriti GhoshTarana PervaizRashmi KapoorKoumudi PatilNitin Gupta","2021","http://link.springer.com/article/10.1038/s41598-021-93258-w","Article"
"DiapixUK: task materials for the elicitation of multiple spontaneous speech dialogs","Behavior Research Methods","","43","3","10.3758/s13428-011-0075-y","Rachel BakerValerie Hazan","2011","http://link.springer.com/article/10.3758/s13428-011-0075-y","Article"
"Electrocortical Dynamics in Children with a Language-Learning Impairment Before and After Audiovisual Training","Brain Topography","","29","3","10.1007/s10548-015-0466-y","Sabine HeimNaseem ChoudhuryApril A. Benasich","2016","http://link.springer.com/article/10.1007/s10548-015-0466-y","Article"
"Incitement: A Study in Language Crime","Criminal Law and Philosophy","","12","2","10.1007/s11572-017-9427-8","Joseph Jaconelli","2018","http://link.springer.com/article/10.1007/s11572-017-9427-8","Article"
"A Multicentre, Randomised, Open-Label, Prospective Study to Estimate the Add-On Effects Of Memantine as Ebixa® Oral Pump (Solution) on Language in Patients with Moderate to Severe Alzheimer’s Disease Already Receiving Donepezil (ROMEO-AD)","Neurology and Therapy","","12","4","10.1007/s40120-023-00494-5","Hee-Jin KimYongSoo ShimHyun Jeong HanByeong C. KimKee Hyung ParkSo Young MoonSeong Hye ChoiDong Won YangBora YoonEun-Joo KimJee Hyang JeongSeol-Heui Han","2023","http://link.springer.com/article/10.1007/s40120-023-00494-5","Article"
"ClearSpeechTogether: a Rater Blinded, Single, Controlled Feasibility Study of Speech Intervention for People with Progressive Ataxia","The Cerebellum","","22","5","10.1007/s12311-022-01462-9","Anja LowitJessica CoxMelissa LoucasJennifer GrasslyAisling EganFrits van BrenkMarios Hadjivassiliou","2023","http://link.springer.com/article/10.1007/s12311-022-01462-9","Article"
"Stable eye versus mouth preference in a live speech-processing task","Scientific Reports","","13","1","10.1038/s41598-023-40017-8","Charlotte ViktorssonNiilo V. ValtakariTerje Falck-YtterIgnace T. C. HoogeMaja RudlingRoy S. Hessels","2023","http://link.springer.com/article/10.1038/s41598-023-40017-8","Article"
"Game-Based Speech Rehabilitation for People with Parkinson’s Disease","Universal Access in Human–Computer Interaction. Human and Technological Environments","","","","10.1007/978-3-319-58700-4_7","Juliane MühlhausHendrike FriegKerstin BildaUte Ritterfeld","2017","http://link.springer.com/chapter/10.1007/978-3-319-58700-4_7","Chapter"
"A magnetic resonance imaging study on the articulatory and acoustic speech parameters of Malay vowels","BioMedical Engineering OnLine","","13","1","10.1186/1475-925X-13-103","Alireza ZourmandSeyed Mostafa MirhassaniHua-Nong TingShaik Ismail BuxKwan Hoong NgMehmet BilgenMohd Amin Jalaludin","2014","http://link.springer.com/article/10.1186/1475-925X-13-103","Article"
"Selective deficit of second language: a case study of a brain-damaged Arabic-Hebrew bilingual patient","Behavioral and Brain Functions","","5","1","10.1186/1744-9081-5-17","Raphiq Ibrahim","2009","http://link.springer.com/article/10.1186/1744-9081-5-17","Article"
"Quoted speech in linguistics research article titles: patterns of use and effects on citations","Scientometrics","","126","4","10.1007/s11192-020-03827-5","William S. Pearson","2021","http://link.springer.com/article/10.1007/s11192-020-03827-5","Article"
"Cantonese AphasiaBank: An annotated database of spoken discourse and co-verbal gestures by healthy and language-impaired native Cantonese speakers","Behavior Research Methods","","51","3","10.3758/s13428-018-1043-6","Anthony Pak-Hin KongSam-Po Law","2019","http://link.springer.com/article/10.3758/s13428-018-1043-6","Article"
"Parallels in the sequential organization of birdsong and human speech","Nature Communications","","10","1","10.1038/s41467-019-11605-y","Tim SainburgBrad TheilmanMarvin ThielkTimothy Q. Gentner","2019","http://link.springer.com/article/10.1038/s41467-019-11605-y","Article"
