Item Title,Publication Title,Book Series Title,Journal Volume,Journal Issue,Item DOI,Authors,Publication Year,URL,Content Type
"Recall of order information by deaf signers: Phonetic coding in temporal order recall","Memory & Cognition","","18","6","10.3758/BF03197103","Vicki L. Hanson","1990","http://link.springer.com/article/10.3758/BF03197103","Article"
"Working memory load differentially affects tip-of-the-tongue states and feeling-of-knowing judgments","Memory & Cognition","","36","1","10.3758/MC.36.1.9","Bennett L. Schwartz","2008","http://link.springer.com/article/10.3758/MC.36.1.9","Article"
"A Preliminary Examination of the Impact of Working Memory Training on Syntax and Processing Speed in Children with ASD","Journal of Autism and Developmental Disorders","","52","10","10.1007/s10803-021-05295-z","Hélène DelageInge-Marie EigstiEmily StanfordStephanie Durrleman","2022","http://link.springer.com/article/10.1007/s10803-021-05295-z","Article"
"Dynamic tests as a language-free method for assessing reading in a multilingual setting","Journal of Cultural Cognitive Science","","7","2","10.1007/s41809-023-00120-8","Rachel E. PyeHuey Hwa Chan","2023","http://link.springer.com/article/10.1007/s41809-023-00120-8","Article"
"Gender Bender: Gender Errors in L2 Pronoun Production","Journal of Psycholinguistic Research","","39","2","10.1007/s10936-009-9129-z","Inés Antón-Méndez","2010","http://link.springer.com/article/10.1007/s10936-009-9129-z","Article"
"The homotopic connectivity of the functional brain: a meta-analytic approach","Scientific Reports","","9","1","10.1038/s41598-019-40188-3","Lorenzo MancusoTommaso CostaAndrea NaniJordi ManuelloDonato LiloiaGabriele GelminiMelissa PaneroSergio DucaFranco Cauda","2019","http://link.springer.com/article/10.1038/s41598-019-40188-3","Article"
"The nature of the visual environment induces implicit biases during language-mediated visual search","Memory & Cognition","","39","6","10.3758/s13421-011-0086-z","Falk HuettigJames M. McQueen","2011","http://link.springer.com/article/10.3758/s13421-011-0086-z","Article"
"Children’s neurodevelopment of reading is affected by China’s language input system in the information era","npj Science of Learning","","5","1","10.1038/s41539-020-0062-0","Wei ZhouVeronica P. Y. KwokMengmeng SuJin LuoLi Hai Tan","2020","http://link.springer.com/article/10.1038/s41539-020-0062-0","Article"
"Verb doubling in Mandarin Chinese","Journal of East Asian Linguistics","","22","1","10.1007/s10831-012-9095-6","Lisa Lai-Shen ChengLuis Vicente","2013","http://link.springer.com/article/10.1007/s10831-012-9095-6","Article"
"Study protocol: a comprehensive multi-method neuroimaging approach to disentangle developmental effects and individual differences in second language learning","BMC Psychology","","10","1","10.1186/s40359-022-00873-x","W. M. MenksC. EkerdtG. JanzenE. KiddK. LemhöferG. FernándezJ. M. McQueen","2022","http://link.springer.com/article/10.1186/s40359-022-00873-x","Article"
"Discrimination of auditory target dimensions in the presence or absence of variation in a second dimension by infants","Perception & Psychophysics","","31","3","10.3758/BF03202536","Patricia K. KuhlJames D. Miller","1982","http://link.springer.com/article/10.3758/BF03202536","Article"
"Morpheme-based approach versus word-based approach: classifying derivative words with respect to their bases","Russian Linguistics","","42","2","10.1007/s11185-018-9197-5","Fadhel Abbas Shalal","2018","http://link.springer.com/article/10.1007/s11185-018-9197-5","Article"
"Perception of movement in American Sign Language: Effects of linguistic structure and linguistic experience","Perception & Psychophysics","","33","3","10.3758/BF03202858","Howard Poizner","1983","http://link.springer.com/article/10.3758/BF03202858","Article"
"Using spatial frequency adaptation to study word recognition","Behavior Research Methods","","39","4","10.3758/BF03192983","Timothy R. JordanSusan M. ShermanGeoffrey R. Patching","2007","http://link.springer.com/article/10.3758/BF03192983","Article"
"On the relevance of locus equations for production and perception of stop consonants","Perception & Psychophysics","","60","1","10.3758/BF03211916","Lawrence BrancazioCarol A. Fowler","1998","http://link.springer.com/article/10.3758/BF03211916","Article"
"Automatic phonological coding of unattended printed words","Memory & Cognition","","10","5","10.3758/BF03197645","Geoffrey UnderwoodSandra Thwaites","1982","http://link.springer.com/article/10.3758/BF03197645","Article"
"Language Profiles in ASD, SLI, and ADHD","Journal of Autism and Developmental Disorders","","38","10","10.1007/s10803-008-0587-1","Hilde M. GeurtsMariëtte Embrechts","2008","http://link.springer.com/article/10.1007/s10803-008-0587-1","Article"
"More than meets the eye: Context effects in word identification","Memory & Cognition","","26","6","10.3758/BF03201198","Michael E. J. MassonRon Borowsky","1998","http://link.springer.com/article/10.3758/BF03201198","Article"
"Spelling improvement through letter-sound and whole-word training in two multilingual Greek- and English- speaking children","Multilingual Education","","4","1","10.1186/s13616-014-0020-3","Georgia Z NiolakiJackie MastersonAris R Terzopoulos","2014","http://link.springer.com/article/10.1186/s13616-014-0020-3","Article"
"Search and selection processes in implicit and explicit word-stem completion performance in young, middle-aged, and older adults","Memory & Cognition","","29","5","10.3758/BF03200470","Lee RyanArne OstergaardLauren NortonJennifer Johnson","2001","http://link.springer.com/article/10.3758/BF03200470","Article"
"Mini Pinyin: A modified miniature language for studying language learning and incremental sentence processing","Behavior Research Methods","","53","3","10.3758/s13428-020-01473-6","Zachariah R. CrossLena Zou-WilliamsErica M. WilkinsonMatthias SchlesewskyIna Bornkessel-Schlesewsky","2021","http://link.springer.com/article/10.3758/s13428-020-01473-6","Article"
"Object shift and subject shift","The Journal of Comparative Germanic Linguistics","","10","2","10.1007/s10828-007-9009-6","Hans Broekhuis","2007","http://link.springer.com/article/10.1007/s10828-007-9009-6","Article"
"The effect of sleep on novel word learning in healthy adults: A systematic review and meta-analysis","Psychonomic Bulletin & Review","","28","6","10.3758/s13423-021-01980-3","Emma A. E. SchimkeAnthony J. AngwinBonnie B. Y. ChengDavid A. Copland","2021","http://link.springer.com/article/10.3758/s13423-021-01980-3","Article"
"The simple view of reading and its broad types of reading difficulties","Reading and Writing","","","","10.1007/s11145-023-10471-x","Wesley A. Hoover","2023","http://link.springer.com/article/10.1007/s11145-023-10471-x","Article"
"Abnormalities in gamma-band responses to language stimuli in first-degree relatives of children with autism spectrum disorder: an MEG study","BMC Psychiatry","","12","1","10.1186/1471-244X-12-213","Kristina L McFaddenSusan HepburnErin WinterrowdGwenda L SchmidtDonald C Rojas","2012","http://link.springer.com/article/10.1186/1471-244X-12-213","Article"
"SCOPE: The South Carolina psycholinguistic metabase","Behavior Research Methods","","55","6","10.3758/s13428-022-01934-0","Chuanji GaoSvetlana V. ShinkarevaRutvik H. Desai","2023","http://link.springer.com/article/10.3758/s13428-022-01934-0","Article"
"Brain structural and functional correlates of the heterogenous progression of mixed transcortical aphasia","Brain Structure and Function","","228","5","10.1007/s00429-023-02655-6","Diana López-BarrosoJosé Paredes-PachecoMaría José Torres-PriorisGuadalupe DávilaMarcelo L. Berthier","2023","http://link.springer.com/article/10.1007/s00429-023-02655-6","Article"
"Reading comprehension in children with Down syndrome","Reading and Writing","","29","1","10.1007/s11145-015-9578-8","Glynis LawsHeather BrownElizabeth Main","2016","http://link.springer.com/article/10.1007/s11145-015-9578-8","Article"
"Congruency effects in the letter search task: Semantic activation in the absence of priming","Memory & Cognition","","35","3","10.3758/BF03193291","Keith A. HutchisonFrank A. Bosco","2007","http://link.springer.com/article/10.3758/BF03193291","Article"
"Intercultural Competence and Pragmatics","","","","","10.1007/978-3-031-44472-2","Gila A. Schauer","2024","http://link.springer.com/book/10.1007/978-3-031-44472-2","Book"
"ADHD learners as victims or survivors in L2 learning contexts: a case of application of dynamic assessment to selective attention and reading comprehension ability","Asian-Pacific Journal of Second and Foreign Language Education","","9","1","10.1186/s40862-023-00229-x","Hadiseh SalehiRoya KhoiiMojgan RashtchiAli Akbar Arjmandnia","2024","http://link.springer.com/article/10.1186/s40862-023-00229-x","Article"
"Effects of memory load in a word-naming task: Five failures to replicate","Memory & Cognition","","23","5","10.3758/BF03197260","Penny M. PexmaStephen J. Lupker","1995","http://link.springer.com/article/10.3758/BF03197260","Article"
"Grammatical gender in spoken word recognition in German","Perception & Psychophysics","","66","6","10.3758/BF03194992","Jens BölteCynthia M. Connine","2004","http://link.springer.com/article/10.3758/BF03194992","Article"
"Effects of sign language experience on categorical perception of dynamic ASL pseudosigns","Attention, Perception, & Psychophysics","","72","3","10.3758/APP.72.3.747","Catherine T. BestGaurav MathurKaren A. MirandaDiane Lillo-Martin","2010","http://link.springer.com/article/10.3758/APP.72.3.747","Article"
"An alternative to grapheme-phoneme conversion rules?","Memory & Cognition","","10","5","10.3758/BF03197649","Marcus Taft","1982","http://link.springer.com/article/10.3758/BF03197649","Article"
"Character gated recurrent neural networks for Arabic sentiment analysis","Scientific Reports","","12","1","10.1038/s41598-022-13153-w","Eslam OmaraMervat MousaNabil Ismail","2022","http://link.springer.com/article/10.1038/s41598-022-13153-w","Article"
"Introduction: Power of Articulation","Power of Articulation","","","","10.1007/978-3-031-33077-3_1","Matti Kortesoja","2023","http://link.springer.com/chapter/10.1007/978-3-031-33077-3_1","Chapter"
"Readers of Chinese extract semantic information from parafoveal words","Psychonomic Bulletin & Review","","16","3","10.3758/PBR.16.3.561","Ming YanEike M. RichterHua ShuReinhold Kliegl","2009","http://link.springer.com/article/10.3758/PBR.16.3.561","Article"
"Orthographic neighborhood density modulates the size of transposed-letter priming effects","Cognitive, Affective, & Behavioral Neuroscience","","21","5","10.3758/s13415-021-00905-w","Gabriela MeadeCécile MahnichPhillip J. HolcombJonathan Grainger","2021","http://link.springer.com/article/10.3758/s13415-021-00905-w","Article"
"The morph as a minimal linguistic form","Morphology","","30","2","10.1007/s11525-020-09355-5","Martin Haspelmath","2020","http://link.springer.com/article/10.1007/s11525-020-09355-5","Article"
"Do you want /ʃoloka/ on a /bistɔk/? On the scope of transposed-phoneme effects with non-adjacent phonemes","Psychonomic Bulletin & Review","","28","5","10.3758/s13423-021-01926-9","Sophie DufourJonathan MiraultJonathan Grainger","2021","http://link.springer.com/article/10.3758/s13423-021-01926-9","Article"
"Multistable syllables as enacted percepts: a source of an asymmetric bias in the verbal transformation effect","Perception & Psychophysics","","68","3","10.3758/BF03193690","Marc SatoJean-Luc SchwartzChristian AbryMarie-Agnès CathiardHélène Loevenbruck","2006","http://link.springer.com/article/10.3758/BF03193690","Article"
"Putting PIRLS to Use in Classrooms Across the Globe","IEA Research for Educators","","","","10.1007/978-3-030-95266-2","Drs. Marian BrugginkDr. Nicole SwartAnnelies van der LeeProf. Dr. Eliane Segers","2022","http://link.springer.com/book/10.1007/978-3-030-95266-2","Book"
"Building the perfect curse word: A psycholinguistic investigation of the form and meaning of taboo words","Psychonomic Bulletin & Review","","27","1","10.3758/s13423-019-01685-8","Jamie ReillyAlexandra KellyBonnie M. ZuckermanPeter P. TwiggMelissa WellsKatie R. JobsonMaurice Flurie","2020","http://link.springer.com/article/10.3758/s13423-019-01685-8","Article"
"Language contact and V3 in Germanic varieties new and old","The Journal of Comparative Germanic Linguistics","","20","1","10.1007/s10828-017-9084-2","George Walkden","2017","http://link.springer.com/article/10.1007/s10828-017-9084-2","Article"
"Explicit authenticity and stimulus features interact to modulate BOLD response induced by emotional speech","Cognitive, Affective, & Behavioral Neuroscience","","13","2","10.3758/s13415-013-0151-0","Matthis DroletRicarda I. SchubotzJulia Fischer","2013","http://link.springer.com/article/10.3758/s13415-013-0151-0","Article"
"The importance of vowel diacritics for the temporary retention of high and low frequency Hebrew words of varying syllabic length","Memory & Cognition","","39","3","10.3758/s13421-010-0026-3","Vered Vaknin-NusbaumPaul Miller","2011","http://link.springer.com/article/10.3758/s13421-010-0026-3","Article"
"European Language Equality","Cognitive Technologies","","","","10.1007/978-3-031-28819-7","Georg RehmAndy Way","2023","http://link.springer.com/book/10.1007/978-3-031-28819-7","Book"
"A cross-lingual adaptation approach for rapid development of speech recognizers for learning disabled users","EURASIP Journal on Audio, Speech, and Music Processing","","2014","1","10.1186/s13636-014-0039-0","Marek BohacMichaela KucharovaZoraida CallejasJan NouzaPetr Červa","2014","http://link.springer.com/article/10.1186/s13636-014-0039-0","Article"
"Letter-position coding in random consonant arrays","Perception & Psychophysics","","57","6","10.3758/BF03206802","Francesca PeressottiJonathan Grainger","1995","http://link.springer.com/article/10.3758/BF03206802","Article"
"A meta-analysis on neural changes of cognitive training for mental disorders in executive function tasks: increase or decrease brain activation?","BMC Psychiatry","","22","1","10.1186/s12888-022-03796-4","Jin Yang LiHuiqin WuShiting YuanChun WangQian WangYuan ZhongNing ZhangKathi HeffnerPeter T. Fox","2022","http://link.springer.com/article/10.1186/s12888-022-03796-4","Article"
"Phonological similarity neighborhoods and children’s short-term memory: Typical development and dyslexia","Memory & Cognition","","33","7","10.3758/BF03193223","Jennifer M. ThomsonUlla RichardsonUsha Goswami","2005","http://link.springer.com/article/10.3758/BF03193223","Article"
"Single-neuronal elements of speech production in humans","Nature","","626","7999","10.1038/s41586-023-06982-w","Arjun R. KhannaWilliam MuñozYoung Joon KimYoav KfirAngelique C. PaulkMohsen JamaliJing CaiMartina L. MustrophIrene CapraraRichard HardstoneMackenna MejdellDomokos MeszénaAbigail ZuckermanJeffrey SchweitzerSydney CashZiv M. Williams","2024","http://link.springer.com/article/10.1038/s41586-023-06982-w","Article"
"The Aromatase Gene CYP19A1: Several Genetic and Functional Lines of Evidence Supporting a Role in Reading, Speech and Language","Behavior Genetics","","42","4","10.1007/s10519-012-9532-3","Heidi AnthoniLara E. SuchestonBarbara A. LewisIsabel Tapia-PáezXiaotang FanMarco ZucchelliMikko TaipaleCatherine M. SteinMarie-Estelle HokkanenEero CastrénBruce F. PenningtonShelley D. SmithRichard K. OlsonJ. Bruce TomblinGerd Schulte-KörneMarkus Nöthen","2012","http://link.springer.com/article/10.1007/s10519-012-9532-3","Article"
"Relationship between early language skills and the development of inattention/hyperactivity symptoms during the preschool period: Results of the EDEN mother-child cohort","BMC Psychiatry","","16","1","10.1186/s12888-016-1091-3","Hugo PeyreCedric GaleraJudith van der WaerdenNicolas HoertelJonathan Y. BernardMaria MelchiorFranck Ramus","2016","http://link.springer.com/article/10.1186/s12888-016-1091-3","Article"
"Language development after cochlear implantation: an epigenetic model","Journal of Neurodevelopmental Disorders","","3","4","10.1007/s11689-011-9098-z","Timothy M. MarkmanAlexandra L. QuittnerLaurie S. EisenbergEmily A. TobeyDonna ThalJohn K. NiparkoNae-Yuh Wang","2011","http://link.springer.com/article/10.1007/s11689-011-9098-z","Article"
"The British Association: Section H.: Anthropology: Opening Address","Nature","","36","935","10.1038/036511a0","PROF. A. H. SAYCE","1887","http://link.springer.com/article/10.1038/036511a0","Article"
"The early effects of external and internal strategies on working memory updating training","Scientific Reports","","8","1","10.1038/s41598-018-22396-5","Matti LaineDaniel FellmanOtto WarisThomas J. Nyman","2018","http://link.springer.com/article/10.1038/s41598-018-22396-5","Article"
"Using statistical smoothing to estimate the psycholinguistic acceptability of novel phrases","Behavior Research Methods","","40","1","10.3758/BRM.40.1.84","Matthew A. J. RobertsNick Chater","2008","http://link.springer.com/article/10.3758/BRM.40.1.84","Article"
"SoundHunters: Increasing Learner Phonological Awareness in Plains Cree","Artificial Intelligence in Education","","","","10.1007/978-3-030-52237-7_28","Delaney LothianGokce AkcayirAnaka SparrowOwen McleodCarrie Demmans Epp","2020","http://link.springer.com/chapter/10.1007/978-3-030-52237-7_28","Chapter"
"Acquisition of consonant clusters and remediation of cluster reduction in Egyptian children","The Egyptian Journal of Otolaryngology","","39","1","10.1186/s43163-023-00379-2","Marwa Mahmoud SalehAhmed Ashraf S. El-HamsharyEman Talaat Fekry FaragMaha Hussein Boshnaq","2023","http://link.springer.com/article/10.1186/s43163-023-00379-2","Article"
"Prosodic assessment in Egyptian children with specific language impairment","The Egyptian Journal of Otolaryngology","","28","1","10.7123/01.EJO.0000411076.60229.ab","Elham A. ShaheenSahar S. ShohdiNader N. AhmedHeba Ashour","2012","http://link.springer.com/article/10.7123/01.EJO.0000411076.60229.ab","Article"
"Lexique-Infra: grapheme-phoneme, phoneme-grapheme regularity, consistency, and other sublexical statistics for 137,717 polysyllabic French words","Behavior Research Methods","","52","6","10.3758/s13428-020-01396-2","Manuel GimenesCyril PerretBoris New","2020","http://link.springer.com/article/10.3758/s13428-020-01396-2","Article"
"Motor representations underlie the reading of unfamiliar letter combinations","Scientific Reports","","10","1","10.1038/s41598-020-59199-6","Alan TaitzM. Florencia AssaneoDiego E. ShalomMarcos A. Trevisan","2020","http://link.springer.com/article/10.1038/s41598-020-59199-6","Article"
"The importance of semantic similarity to the irrelevant speech effect","Memory & Cognition","","27","1","10.3758/BF03201211","Craig B. NeelyDenny C. LeCompte","1999","http://link.springer.com/article/10.3758/BF03201211","Article"
"Effects of the psycholinguistic variables on the lexical decision task in Spanish: A study with 2,765 words","Behavior Research Methods","","46","2","10.3758/s13428-013-0383-5","María González-NostiAnalía BarbónJavier Rodríguez-FerreiroFernando Cuetos","2014","http://link.springer.com/article/10.3758/s13428-013-0383-5","Article"
"Orthographic depth and developmental dyslexia: a meta-analytic study","Annals of Dyslexia","","71","3","10.1007/s11881-021-00226-0","Desiré CariotiMarta Franca MasiaSimona TravelliniManuela Berlingeri","2021","http://link.springer.com/article/10.1007/s11881-021-00226-0","Article"
"Key language, cognitive and higher-order skills for L2 reading comprehension of expository texts in English as foreign language students: a systematic review","Reading and Writing","","","","10.1007/s11145-023-10479-3","G. VettoriL. Casado LedesmaS. TesoneC. Tarchi","2023","http://link.springer.com/article/10.1007/s11145-023-10479-3","Article"
"Egyptian vowel second formant in isolation and in transition following high-frequency fricatives by NLFC hearing aid in children: how does the pattern compare to typically hearing peers?","The Egyptian Journal of Otolaryngology","","38","1","10.1186/s43163-022-00284-0","Marwa Mahmoud SalehHassnaa Othman MohammedIman Sadek El DanasouryDalia Mohamed HassanSally A. SarwatDina A. Elrefaie","2022","http://link.springer.com/article/10.1186/s43163-022-00284-0","Article"
"The Cognitive Makeup of Writing: Multivariate Analysis of Writing Impairments Following Stroke","Cognitive Computation","","15","1","10.1007/s12559-023-10111-0","Haobo ChenShaode YuXiaoping PanYanjia ChenTian ZhangZe LiJin ZhouJianxi HuWai-Ling BickertonJohnny King LauAihua GuoAnthony Pak Hin KongPia Rotshtein","2023","http://link.springer.com/article/10.1007/s12559-023-10111-0","Article"
"Keeping it together: Semantic coherence stabilizes phonological sequences in short-term memory","Memory & Cognition","","46","3","10.3758/s13421-017-0775-3","Nicola SavillRachel EllisEmma BrookeTiffany KoaSuzie FergusonElena Rojas-RodriguezDominic ArnoldJonathan SmallwoodElizabeth Jefferies","2018","http://link.springer.com/article/10.3758/s13421-017-0775-3","Article"
"Task modulation of disyllabic spoken word recognition in Mandarin Chinese: a unimodal ERP study","Scientific Reports","","6","1","10.1038/srep25916","Xianjun HuangJin-Chen YangRuohan ChangChunyan Guo","2016","http://link.springer.com/article/10.1038/srep25916","Article"
"Hierarchical categorization of coarticulated phonemes: A theoretical analysis","Perception & Psychophysics","","63","7","10.3758/BF03194529","Roel Smits","2001","http://link.springer.com/article/10.3758/BF03194529","Article"
"Papers read at the 25th Annual Meeting of the Psychonomic Society","Bulletin of the Psychonomic Society","","22","4","10.3758/BF03333825","","1984","http://link.springer.com/article/10.3758/BF03333825","Article"
"Children’s novel NN compounding in Swedish diary data: function and form","Morphology","","28","3","10.1007/s11525-018-9325-3","Maria RosenbergIngmarie Mellenius","2018","http://link.springer.com/article/10.1007/s11525-018-9325-3","Article"
"Survival of the grouped, or three’s a crowd? Repetition blindness in groups of letters and words","Memory & Cognition","","44","2","10.3758/s13421-015-0556-9","Andrea JacksonLori Buchanan","2016","http://link.springer.com/article/10.3758/s13421-015-0556-9","Article"
"Representing variation in a spoken corpus of an endangered dialect: the case of Torlak","Language Resources and Evaluation","","55","3","10.1007/s10579-020-09522-4","Teodora Vuković","2021","http://link.springer.com/article/10.1007/s10579-020-09522-4","Article"
"Distilling vector space model scores for the assessment of constructed responses with bifactor Inbuilt Rubric method and latent variables","Behavior Research Methods","","54","5","10.3758/s13428-021-01764-6","José Ángel Martínez-HuertasRicardo OlmosGuillermo Jorge-BotanaJosé A. León","2022","http://link.springer.com/article/10.3758/s13428-021-01764-6","Article"
"Protocol for SonoSpeech Cleft Pilot: a mixed-methods pilot randomized control trial of ultrasound visual biofeedback versus standard intervention for children with cleft lip and palate","Pilot and Feasibility Studies","","8","1","10.1186/s40814-022-01051-x","Joanne ClelandLisa CrampinLinsay CampbellMarie Dokovova","2022","http://link.springer.com/article/10.1186/s40814-022-01051-x","Article"
"Constraints on definite article alternation in speech production: To “thee” or not to “thee”?","Memory & Cognition","","31","5","10.3758/BF03196110","M. Gareth GaskellHelen CoxKatherine FoleyHelen GrieveRachel O’Brien","2003","http://link.springer.com/article/10.3758/BF03196110","Article"
"Discovering phonetic coherence in acoustic patterns","Perception & Psychophysics","","45","3","10.3758/BF03210703","Catherine T. BestMichael Studdert-KennedySharon ManuelJudith Rubin-Spitz","1989","http://link.springer.com/article/10.3758/BF03210703","Article"
"Memory in language-impaired children with and without autism","Journal of Neurodevelopmental Disorders","","7","1","10.1186/s11689-015-9111-z","Alison Presmanes HillJan van SantenKyle GormanBeth Hoover LanghorstEric Fombonne","2015","http://link.springer.com/article/10.1186/s11689-015-9111-z","Article"
"Boolean Monadic Recursive Schemes as a Logical Characterization of the Subsequential Functions","Language and Automata Theory and Applications","","","","10.1007/978-3-030-40608-0_10","Siddharth BhaskarJane ChandleeAdam JardineChristopher Oakden","2020","http://link.springer.com/chapter/10.1007/978-3-030-40608-0_10","Chapter"
"Sonic Signs: Turning to, Talking About, and Transcribing Sound","Sonic Skills","","","","10.1057/978-1-137-59829-5_2","Karin Bijsterveld","2019","http://link.springer.com/chapter/10.1057/978-1-137-59829-5_2","Chapter"
"The role of syllabic structure in French visual word recognition","Memory & Cognition","","29","2","10.3758/BF03194932","Aïcha RouibahMarcus Taft","2001","http://link.springer.com/article/10.3758/BF03194932","Article"
"Testing the BOSS hypothesis: Evidence for position-insensitive orthographic priming in the lexical decision task","Memory & Cognition","","14","6","10.3758/BF03202523","Timothy Richard Jordan","1986","http://link.springer.com/article/10.3758/BF03202523","Article"
"The effects of precipitation variability on the canopy cover of forage species in arid rangelands, Iran","Arabian Journal of Geosciences","","13","18","10.1007/s12517-020-05901-x","Hamed JoneidiNahid AziziKhaled OsatiIsa Bandak","2020","http://link.springer.com/article/10.1007/s12517-020-05901-x","Article"
"Morphological priming: Dissociation of phonological, semantic, and morphological factors","Memory & Cognition","","28","8","10.3758/BF03211828","Ram FrostAvital DeutschOrna GilboaMichal TannenbaumWilliam Marslen-Wilson","2000","http://link.springer.com/article/10.3758/BF03211828","Article"
