Item Title,Publication Title,Book Series Title,Journal Volume,Journal Issue,Item DOI,Authors,Publication Year,URL,Content Type
"Value of early intervention for hearing impairment on language and speech acquisition","The Egyptian Journal of Otolaryngology","","30","3","10.4103/1012-5574.138483","Ebtessam NadaAhmad KhaterAmal Saeed","2014","http://link.springer.com/article/10.4103/1012-5574.138483","Article"
"Prelexical phonologic computation in a deep orthography: Evidence from backward masking in Hebrew","Psychonomic Bulletin & Review","","4","1","10.3758/BF03210781","Nurit GronauRam Frost","1997","http://link.springer.com/article/10.3758/BF03210781","Article"
"A CPML-Signwriting Interpreter: A New form to Generate the Graphical Symbols of Signwriting","Universal Access in Human-Computer Interaction. Design and Development Methods for Universal Access","","","","10.1007/978-3-319-07437-5_34","Carlos E. A. IatskiuLaura Sánchez GarcíaDiego Roberto AntunesAndré Luiz Pires Guedes","2014","http://link.springer.com/chapter/10.1007/978-3-319-07437-5_34","Chapter"
"Introduction to the special issue on literacy in Arabic","Reading and Writing","","24","9","10.1007/s11145-011-9306-y","Abdessatar MahfoudhiJohn EverattGad Elbeheri","2011","http://link.springer.com/article/10.1007/s11145-011-9306-y","Article"
"A Context-Based Collaborative Framework to Build Sign Language Databases by Real Users","Universal Access in Human-Computer Interaction. Access to Interaction","","","","10.1007/978-3-319-20681-3_31","Diego Roberto AntunesAndré L. P. GuedesLaura Sánchez García","2015","http://link.springer.com/chapter/10.1007/978-3-319-20681-3_31","Chapter"
"A brain-region-based meta-analysis method utilizing the Apriori algorithm","BMC Neuroscience","","17","1","10.1186/s12868-016-0257-8","Zhendong NiuYaoxin NieQian ZhouLinlin ZhuJieyao Wei","2016","http://link.springer.com/article/10.1186/s12868-016-0257-8","Article"
"The time course of orthographic and phonological code activation in the early phases of visual word recognition","Bulletin of the Psychonomic Society","","31","2","10.3758/BF03334157","Ludovic FerrandJonathan Grainger","1993","http://link.springer.com/article/10.3758/BF03334157","Article"
"A phoneme-grapheme feedback consistency effect","Psychonomic Bulletin & Review","","10","2","10.3758/BF03196497","Conrad Perry","2003","http://link.springer.com/article/10.3758/BF03196497","Article"
"The activation of segmental and tonal information in visual word recognition","Psychonomic Bulletin & Review","","20","4","10.3758/s13423-013-0395-2","Chuchu LiCandise Y. LinMin WangNan Jiang","2013","http://link.springer.com/article/10.3758/s13423-013-0395-2","Article"
"Linear grammar as a possible stepping-stone in the evolution of language","Psychonomic Bulletin & Review","","24","1","10.3758/s13423-016-1073-y","Ray JackendoffEva Wittenberg","2017","http://link.springer.com/article/10.3758/s13423-016-1073-y","Article"
"Spelling-sound effects in reading: Time-course and decision criteria","Memory & Cognition","","13","6","10.3758/BF03198326","Gloria S. WatersMark S. Seidenberg","1985","http://link.springer.com/article/10.3758/BF03198326","Article"
"The processing of consonants and vowels in reading: Evidence from the fast priming paradigm","Psychonomic Bulletin & Review","","9","4","10.3758/BF03196333","Hye-Won LeeKeith RaynerAlexander Pollatsek","2002","http://link.springer.com/article/10.3758/BF03196333","Article"
"PROMPT intervention for children with severe speech motor delay: a randomized control trial","Pediatric Research","","89","3","10.1038/s41390-020-0924-4","Aravind K. NamasivayamAnna HuynhFrancesca GranataVina LawPascal van Lieshout","2021","http://link.springer.com/article/10.1038/s41390-020-0924-4","Article"
"Speech assessment tool methods for speech impaired children: a systematic literature review on the state-of-the-art in Speech impairment analysis","Multimedia Tools and Applications","","82","22","10.1007/s11042-023-14913-0","Gowri Prasood UshaJohn Sahaya Rani Alex","2023","http://link.springer.com/article/10.1007/s11042-023-14913-0","Article"
"An Efficient, Probabilistically Sound Algorithm for Segmentation and Word Discovery","Machine Learning","","34","1 - 3","10.1023/A:1007541817488","Michael R. Brent","1999","http://link.springer.com/article/10.1023/A%3A1007541817488","Article"
"The syllable’s role in word naming","Memory & Cognition","","25","4","10.3758/BF03201122","Ludovic FerrandJuan SeguiGlyn W. Humphreys","1997","http://link.springer.com/article/10.3758/BF03201122","Article"
"Quantity in Old Norse and modern peninsular North Germanic","The Journal of Comparative Germanic Linguistics","","14","1","10.1007/s10828-010-9041-9","Gjert Kristoffersen","2011","http://link.springer.com/article/10.1007/s10828-010-9041-9","Article"
"Sex differences in phonological processes: Speeded matching and word reading","Memory & Cognition","","27","2","10.3758/BF03211409","Raymond L. Majeres","1999","http://link.springer.com/article/10.3758/BF03211409","Article"
"From morphology to syntax","Vector Semantics","","","","10.1007/978-981-19-5607-2_2","András Kornai","2023","http://link.springer.com/chapter/10.1007/978-981-19-5607-2_2","Chapter"
"Phonological similarity and orthographic similarity affect probed serial recall of Chinese characters","Memory & Cognition","","43","3","10.3758/s13421-014-0495-x","Yi-Chen LinHsiang-Yu ChenYvonne C. LaiDenise H. Wu","2015","http://link.springer.com/article/10.3758/s13421-014-0495-x","Article"
"Implementation and acceptance of national language policy: the case of Dutch (1750–1850)","Language Policy","","19","2","10.1007/s10993-019-09527-y","Gijsbert RuttenAndreas KrogullBob Schoemaker","2020","http://link.springer.com/article/10.1007/s10993-019-09527-y","Article"
"Shallow or deep? The impact of orthographic depth on visual processing impairments in developmental dyslexia","Annals of Dyslexia","","72","1","10.1007/s11881-021-00249-7","Serena ProvazzaBarbara CarrettiDavid GiofrèAnne-Marie AdamsLorena MontesanoDaniel Roberts","2022","http://link.springer.com/article/10.1007/s11881-021-00249-7","Article"
"Differential Diagnosis of Pediatric Speech Sound Disorder","Current Developmental Disorders Reports","","1","3","10.1007/s40474-014-0017-3","Barbara Dodd","2014","http://link.springer.com/article/10.1007/s40474-014-0017-3","Article"
"Historical gender change in West Frisian","Morphology","","21","1","10.1007/s11525-010-9162-5","Willem Visser","2011","http://link.springer.com/article/10.1007/s11525-010-9162-5","Article"
"Are phonological skills as crucial for literacy acquisition in Japanese as in English as well as in accounting for developmental dyslexia in English and in Japanese?","Journal of Cultural Cognitive Science","","7","2","10.1007/s41809-023-00126-2","Taeko N. Wydell","2023","http://link.springer.com/article/10.1007/s41809-023-00126-2","Article"
"Evidence for cross-script abstract identities in learners of Japanese kana","Memory & Cognition","","46","6","10.3758/s13421-018-0818-4","Teresa SchubertRoderick GawthropSachiko Kinoshita","2018","http://link.springer.com/article/10.3758/s13421-018-0818-4","Article"
"Depth of phonological recoding in short-term memory","Memory & Cognition","","19","3","10.3758/BF03211150","Yi Xu","1991","http://link.springer.com/article/10.3758/BF03211150","Article"
"Left peripheral focus: mismatches between syntax and information structure","Natural Language & Linguistic Theory","","29","1","10.1007/s11049-010-9109-x","Gisbert FanselowDenisa Lenertová","2011","http://link.springer.com/article/10.1007/s11049-010-9109-x","Article"
"Dutch dyslexic adolescents: phonological-core variable-orthographic differences","Reading and Writing","","22","2","10.1007/s11145-007-9105-7","Judith BekebredeAryan van der LeijDavid L. Share","2009","http://link.springer.com/article/10.1007/s11145-007-9105-7","Article"
"An XMG Account of Multiplicity of Meaning in Derivation","Concepts, Frames and Cascades in Semantics, Cognition and Ontology","","","","10.1007/978-3-030-50200-3_9","Marios AndreouSimon Petitjean","2021","http://link.springer.com/chapter/10.1007/978-3-030-50200-3_9","Chapter"
"The mental representation of sounds in speech sound disorders","Humanities and Social Sciences Communications","","8","1","10.1057/s41599-021-00706-z","Soujanya PathiPrakash Mondal","2021","http://link.springer.com/article/10.1057/s41599-021-00706-z","Article"
"Privileged access to action for objects relative to words","Psychonomic Bulletin & Review","","9","2","10.3758/BF03196292","Hanna ChainayGlyn W. Humphreys","2002","http://link.springer.com/article/10.3758/BF03196292","Article"
"Database of word-level statistics for Mandarin Chinese (DoWLS-MAN)","Behavior Research Methods","","54","2","10.3758/s13428-021-01620-7","Karl David NeergaardHongzhi XuJames S. GermanChu-Ren Huang","2022","http://link.springer.com/article/10.3758/s13428-021-01620-7","Article"
"Not all grammatical features are robustly transmitted during the emergence of creoles","Humanities and Social Sciences Communications","","7","1","10.1057/s41599-020-00611-x","Sandro Sessarego","2020","http://link.springer.com/article/10.1057/s41599-020-00611-x","Article"
"Illusory words created by repetition blindness: A technique for probing sublexical representations","Psychonomic Bulletin & Review","","8","1","10.3758/BF03196147","Catherine L. HarrisAlison L. Morris","2001","http://link.springer.com/article/10.3758/BF03196147","Article"
"Longitudinal cognitive biomarkers predicting symptom onset in presymptomatic frontotemporal dementia","Journal of Neurology","","265","6","10.1007/s00415-018-8850-7","Lize C. JiskootJessica L. PanmanLauren van AsseldonkSanne FranzenLieke H. H. MeeterLaura Donker KaatEmma L. van der EndeElise G. P. DopperReinier TimmanRick van MinkelenJohn C. van SwietenEsther van den BergJanne M. Papma","2018","http://link.springer.com/article/10.1007/s00415-018-8850-7","Article"
"Loss of rapid phonological recoding in reading Hanja, the logographic script of Korean","Psychonomic Bulletin & Review","","8","4","10.3758/BF03196218","Jeesun KimChris Davis","2001","http://link.springer.com/article/10.3758/BF03196218","Article"
"Neural mechanisms underlying the facilitation of naming in aphasia using a semantic task: an fMRI study","BMC Neuroscience","","13","1","10.1186/1471-2202-13-98","Shiree HeathKatie L McMahonLyndsey NickelsAnthony AngwinAnna D MacDonaldSophia van HeesKori JohnsonEril McKinnonDavid A Copland","2012","http://link.springer.com/article/10.1186/1471-2202-13-98","Article"
"Pronunciation-Enhanced Chinese Word Embedding","Cognitive Computation","","13","3","10.1007/s12559-021-09850-9","Qinjuan YangHaoran XieGary ChengFu Lee WangYanghui Rao","2021","http://link.springer.com/article/10.1007/s12559-021-09850-9","Article"
"The natural history of verb-stem reduplication in Bantu","Morphology","","19","2","10.1007/s11525-009-9140-y","Larry M. Hyman","2009","http://link.springer.com/article/10.1007/s11525-009-9140-y","Article"
"Super Linguistics: an introduction","Linguistics and Philosophy","","46","4","10.1007/s10988-022-09377-8","Pritty Patel-GroszSalvador MascarenhasEmmanuel ChemlaPhilippe Schlenker","2023","http://link.springer.com/article/10.1007/s10988-022-09377-8","Article"
"A “word length effect”for sign language: Further evidence for the role of language in structuring working memory","Memory & Cognition","","26","3","10.3758/BF03201164","Margaret WilsonKaren Emmorey","1998","http://link.springer.com/article/10.3758/BF03201164","Article"
"Phonological recoding and lexical access","Memory & Cognition","","6","4","10.3758/BF03197471","Eileen DavelaarMax ColtheartDerek BesnerJon Torfi Jonasson","1978","http://link.springer.com/article/10.3758/BF03197471","Article"
"Something old, something new: A review of the literature on sleep-related lexicalization of novel words in adults","Psychonomic Bulletin & Review","","28","1","10.3758/s13423-020-01809-5","Pauline PalmaDebra Titone","2021","http://link.springer.com/article/10.3758/s13423-020-01809-5","Article"
"The effect of orthographic similarity on lexical retrieval: Resolving neighborhood conflicts","Psychonomic Bulletin & Review","","4","4","10.3758/BF03214334","Sally Andrews","1997","http://link.springer.com/article/10.3758/BF03214334","Article"
"Binomial adjective doublets in Japanese: A Relational Morphology account","Morphology","","32","3","10.1007/s11525-022-09395-z","Kimi AkitaKeiko Murasugi","2022","http://link.springer.com/article/10.1007/s11525-022-09395-z","Article"
"Multiplex lexical networks reveal patterns in early word acquisition in children","Scientific Reports","","7","1","10.1038/srep46730","Massimo StellaNicole M. BeckageMarkus Brede","2017","http://link.springer.com/article/10.1038/srep46730","Article"
"Attentional strategic control over nonlexical and lexical processing in written spelling to dictation in adults","Memory & Cognition","","33","1","10.3758/BF03195297","Patrick BoninSandra CollayMichel PayolaAlain Méot","2005","http://link.springer.com/article/10.3758/BF03195297","Article"
"Grammars Across Time Analyzed (GATA): a dataset of 52 languages","Scientific Data","","10","1","10.1038/s41597-023-02659-1","Frederic BlumCarlos BarrientosAdriano IngunzaDamián E. BlasiRoberto Zariquiey","2023","http://link.springer.com/article/10.1038/s41597-023-02659-1","Article"
"Papers and Posters Presented at the 34th Annual Meeting of the Psychonomic Society The Omni Shoreham Hotel, Washington, D.C. November 5–7, 1993","Bulletin of the Psychonomic Society","","31","4","10.3758/BF03334949","","1993","http://link.springer.com/article/10.3758/BF03334949","Article"
"An ERP investigation of visual word recognition in syllabary scripts","Cognitive, Affective, & Behavioral Neuroscience","","13","2","10.3758/s13415-013-0149-7","Kana OkanoJonathan GraingerPhillip J. Holcomb","2013","http://link.springer.com/article/10.3758/s13415-013-0149-7","Article"
"Imaging the past: Neural activation in frontal and temporal regions during regular and irregular past-tense processing","Cognitive, Affective, & Behavioral Neuroscience","","5","3","10.3758/CABN.5.3.282","Marc F. JoanisseMark S. Seidenberg","2005","http://link.springer.com/article/10.3758/CABN.5.3.282","Article"
"Centro-parietal N200: An event-related potential component specific to Chinese visual word recognition","Chinese Science Bulletin","","57","13","10.1007/s11434-011-4932-y","John X. ZhangZhuo FangYingChun DuLingYue KongQin ZhangQiang Xing","2012","http://link.springer.com/article/10.1007/s11434-011-4932-y","Article"
"The representational basis of syllable categories","Perception & Psychophysics","","59","6","10.3758/BF03205505","Stef Decoene","1997","http://link.springer.com/article/10.3758/BF03205505","Article"
"The Software System LingvoDoc and the Possibilities It Offers for Documentation and Analysis of Ob-Ugric Languages","Doklady Mathematics","","105","3","10.1134/S106456242203005X","Yu. V. NormanskajaO. D. BorisenkoI. B. BeloborodovAcademician of RAS A. I. Avetisyan","2022","http://link.springer.com/article/10.1134/S106456242203005X","Article"
"Invariants, specifiers, cues: An investigation of locus equations as information for place of articulation","Perception & Psychophysics","","55","6","10.3758/BF03211675","Carol A. Fowler","1994","http://link.springer.com/article/10.3758/BF03211675","Article"
"Phonographic neighbors, not orthographic neighbors, determine word naming latencies","Psychonomic Bulletin & Review","","14","3","10.3758/BF03194088","James S. AdelmanGordon D. A. Brown","2007","http://link.springer.com/article/10.3758/BF03194088","Article"
"Age of acquisition estimates for 1,208 ambiguous and polysemous words","Behavior Research Methods","","43","1","10.3758/s13428-010-0027-y","Maya M. KhannaMichael J. Cortese","2011","http://link.springer.com/article/10.3758/s13428-010-0027-y","Article"
"Augmentative and Alternative Communication in the Literacy Teaching for Deaf Children","Learning and Collaboration Technologies. Technology in Education","","","","10.1007/978-3-319-58515-4_10","Sandra CanoCésar A. CollazosLeandro Flórez AristizábalFernando Moreira","2017","http://link.springer.com/chapter/10.1007/978-3-319-58515-4_10","Chapter"
"Multiple levels of linguistic and paralinguistic features contribute to voice recognition","Scientific Reports","","5","1","10.1038/srep11475","Jean Mary ZarateXing TianKevin J. P. WoodsDavid Poeppel","2015","http://link.springer.com/article/10.1038/srep11475","Article"
"Grammatical comprehension in developmental semantic-pragmatic disorder","The Egyptian Journal of Otolaryngology","","31","3","10.4103/1012-5574.161607","Sally T. Kheir El-Din MDYossra Sallam","2015","http://link.springer.com/article/10.4103/1012-5574.161607","Article"
"Introduction to the special issue on Japanese geminate obstruents","Journal of East Asian Linguistics","","22","4","10.1007/s10831-013-9109-z","Haruo Kubozono","2013","http://link.springer.com/article/10.1007/s10831-013-9109-z","Article"
"Behavioral and Neuroimaging Research of Reading: a Case of Japanese","Current Developmental Disorders Reports","","2","4","10.1007/s40474-015-0066-2","Taeko N. WydellTadahisa Kondo","2015","http://link.springer.com/article/10.1007/s40474-015-0066-2","Article"
"Dyslexia and Remediation/Education: Where Next?","Current Developmental Disorders Reports","","1","4","10.1007/s40474-014-0029-z","Rhona Stainthorp","2014","http://link.springer.com/article/10.1007/s40474-014-0029-z","Article"
"Effects of association and imageability on phonological mapping","Psychonomic Bulletin & Review","","4","2","10.3758/BF03209397","Michael J. CorteseGreg B. SimpsonSteph Woolsey","1997","http://link.springer.com/article/10.3758/BF03209397","Article"
"Rotterdam Aphasia Therapy Study (RATS) – 3: “The efficacy of intensive cognitive-linguistic therapy in the acute stage of aphasia”; design of a randomised controlled trial","Trials","","14","1","10.1186/1745-6215-14-24","Femke NouwensDiederik WJ DippelMarjolein de Jong-HagelsteinEvy G Visch-BrinkPeter J KoudstaalLonneke M L de Lau","2013","http://link.springer.com/article/10.1186/1745-6215-14-24","Article"
"Allomorphy—its logic and limitations: opening remarks from the guest editors","Morphology","","26","3 - 4","10.1007/s11525-016-9291-6","Noam FaustNicola Lampitelli","2016","http://link.springer.com/article/10.1007/s11525-016-9291-6","Article"
"Transposed-letter priming effects in reading aloud words and nonwords","Psychonomic Bulletin & Review","","22","5","10.3758/s13423-015-0806-7","Petroula MousikouSachiko KinoshitaSimon WuDennis Norris","2015","http://link.springer.com/article/10.3758/s13423-015-0806-7","Article"
"Early markers of lexical stress in visual word recognition","Memory & Cognition","","45","8","10.3758/s13421-017-0735-y","Simone SulpizioLucia Colombo","2017","http://link.springer.com/article/10.3758/s13421-017-0735-y","Article"
"Mora or more? The phonological unit of Japanese word production in the Stroop color naming task","Memory & Cognition","","46","3","10.3758/s13421-017-0774-4","Rinus G. VerdonschotSachiko Kinoshita","2018","http://link.springer.com/article/10.3758/s13421-017-0774-4","Article"
"Semantic information mediates visual attention during spoken word recognition in Chinese: Evidence from the printed-word version of the visual-world paradigm","Attention, Perception, & Psychophysics","","78","5","10.3758/s13414-016-1081-z","Wei ShenQingqing QuXingshan Li","2016","http://link.springer.com/article/10.3758/s13414-016-1081-z","Article"
"Semelfactives are bigger than degree achievements","Natural Language & Linguistic Theory","","37","4","10.1007/s11049-018-9434-z","Lucie Taraldsen MedováBartosz Wiland","2019","http://link.springer.com/article/10.1007/s11049-018-9434-z","Article"
"The Directory","The Writers Directory 1980–82","","","","10.1007/978-1-349-03650-9_1","","1979","http://link.springer.com/chapter/10.1007/978-1-349-03650-9_1","Chapter"
"Bilingualism and Speech Sound Disorders","Current Developmental Disorders Reports","","2","3","10.1007/s40474-015-0049-3","Brian A. GoldsteinChristina E. Gildersleeve-Neumann","2015","http://link.springer.com/article/10.1007/s40474-015-0049-3","Article"
"Parafoveal processing in reading","Attention, Perception, & Psychophysics","","74","1","10.3758/s13414-011-0219-2","Elizabeth R. SchotterBernhard AngeleKeith Rayner","2012","http://link.springer.com/article/10.3758/s13414-011-0219-2","Article"
"Processing lexical ambiguity and visual word recognition in a deep orthography","Memory & Cognition","","15","1","10.3758/BF03197708","Shlomo BentinRam Frost","1987","http://link.springer.com/article/10.3758/BF03197708","Article"
"Effects of orthography in the picture-word task: Evidence from Japanese scripts","Reading and Writing","","35","1","10.1007/s11145-021-10173-2","Alexandra S. DylmanMariko KikutaniMiho SasakiChristopher Barry","2022","http://link.springer.com/article/10.1007/s11145-021-10173-2","Article"
"Reconsidering the Evidence That Systematic Phonics Is More Effective Than Alternative Methods of Reading Instruction","Educational Psychology Review","","32","3","10.1007/s10648-019-09515-y","Jeffrey S. Bowers","2020","http://link.springer.com/article/10.1007/s10648-019-09515-y","Article"
"The nature of skilled adult reading varies with type of instruction in childhood","Memory & Cognition","","37","2","10.3758/MC.37.2.223","G. Brian ThompsonVincent ConnellyClaire M. Fletcher-FlinnSheryl J. Hodson","2009","http://link.springer.com/article/10.3758/MC.37.2.223","Article"
"Middle Dutch back vowels in rhymes","The Journal of Comparative Germanic Linguistics","","17","2","10.1007/s10828-014-9067-5","Johanneke SytsemaJanet GrijzenhoutAditi Lahiri","2014","http://link.springer.com/article/10.1007/s10828-014-9067-5","Article"
"The loci of Stroop effects: a critical review of methods and evidence for levels of processing contributing to color-word Stroop effects and the implications for the loci of attentional selection","Psychological Research","","86","4","10.1007/s00426-021-01554-x","Benjamin A. ParrisNabil HasshimMichael WadsleyMaria AugustinovaLudovic Ferrand","2022","http://link.springer.com/article/10.1007/s00426-021-01554-x","Article"
"Children’s and adults’ use of spelling-sound information in three reading tasks","Memory & Cognition","","12","3","10.3758/BF03197678","Gloria S. WatersMark S. SeidenbergMargaret Bruck","1984","http://link.springer.com/article/10.3758/BF03197678","Article"
"Songbirds work around computational complexity by learning song vocabulary independently of sequence","Nature Communications","","8","1","10.1038/s41467-017-01436-0","Dina LipkindAnja T. ZaiAlexander HanuschkinGary F. MarcusOfer TchernichovskiRichard H. R. Hahnloser","2017","http://link.springer.com/article/10.1038/s41467-017-01436-0","Article"
"Applications of Unsupervised Machine Learning in Autism Spectrum Disorder Research: a Review","Review Journal of Autism and Developmental Disorders","","10","3","10.1007/s40489-021-00299-y","Chelsea M. Parlett-PelleritiElizabeth StevensDennis DixonErik J. Linstead","2023","http://link.springer.com/article/10.1007/s40489-021-00299-y","Article"
"Testing the speech unit hypothesis with the primed matching task: Phoneme categories are perceptually basic","Perception & Psychophysics","","53","6","10.3758/BF03211737","Stef Decoene","1993","http://link.springer.com/article/10.3758/BF03211737","Article"
"Sublexical frequency measures for orthographic and phonological units in German","Behavior Research Methods","","39","3","10.3758/BF03193034","Markus J. HofmannPrisca StennekenMarkus ConradArthur M. Jacobs","2007","http://link.springer.com/article/10.3758/BF03193034","Article"
"What learning Latin verbal morphology tells us about morphological theory","Natural Language & Linguistic Theory","","41","2","10.1007/s11049-022-09553-2","Jordan Kodner","2023","http://link.springer.com/article/10.1007/s11049-022-09553-2","Article"
"Paradigm uniformity effects on French liaison","Natural Language & Linguistic Theory","","","","10.1007/s11049-023-09596-z","Benjamin Storme","2024","http://link.springer.com/article/10.1007/s11049-023-09596-z","Article"
"Phonological similarity effects on detecting change in simple arrays","Memory & Cognition","","34","8","10.3758/BF03195935","Stephen MondyVeronika Coltheart","2006","http://link.springer.com/article/10.3758/BF03195935","Article"
"Cerebellar-Induced Aphasia After Stroke: Evidence for the “Linguistic Cerebellum”","The Cerebellum","","","","10.1007/s12311-024-01658-1","Djaina SatoerPeter J. KoudstaalEvy Visch-BrinkRuben S. van der Giessen","2024","http://link.springer.com/article/10.1007/s12311-024-01658-1","Article"
"Natural language processing: state of the art, current trends and challenges","Multimedia Tools and Applications","","82","3","10.1007/s11042-022-13428-4","Diksha KhuranaAditya KoliKiran KhatterSukhdev Singh","2023","http://link.springer.com/article/10.1007/s11042-022-13428-4","Article"
"Phonological processes and the perception of phonotactically illegal consonant clusters","Perception & Psychophysics","","60","6","10.3758/BF03211930","Mark A. Pitt","1998","http://link.springer.com/article/10.3758/BF03211930","Article"
"Cross-linguistic differences in the use of durational cues for the segmentation of a novel language","Memory & Cognition","","45","5","10.3758/s13421-017-0700-9","Mikhail OrdinLeona PolyanskayaItziar LakaMarina Nespor","2017","http://link.springer.com/article/10.3758/s13421-017-0700-9","Article"
"An exploratory genre analysis of three graduate degree research proposals in applied linguistics","Functional Linguistics","","3","1","10.1186/s40554-016-0032-2","Bin Yin","2016","http://link.springer.com/article/10.1186/s40554-016-0032-2","Article"
